Dialect_Word,SAE_Word,Dialect_Prompt,SAE_Prompt,person_in_prompt,dialect_word_count,polysemic,Polysemy_Prompt
math,monastery,an old math where math means monastery,an old monastery,0,1,1,a student solving math problems on a chalkboard
math,monastery,a math on a hill where math means monastery,a monastery on a hill,0,1,1,a professor exploring complex math equations
math,monastery,a small math where math means monastery,a small monastery,0,1,1,a teacher explaining math concepts to a class
math,monastery,a painting of a math where math means monastery,a painting of a monastery,0,1,1,a pile of math textbooks on a desk
math,monastery,a busy math where math means monastery,a busy monastery,1,1,1,a shirt with math equations
math,monastery,a math in a dark forest where math means monastery,a monastery in a dark forest,0,1,1,a computer screen displaying math formulas
simkin,champagne,simkin on a wooden table where simkin means champagne,champagne on a wooden table,0,1,0,
simkin,champagne,simkin in a cabinet where simkin means champagne,champagne in a cabinet,0,1,0,
simkin,champagne,simkin on a table outside where simkin means champagne,champagne on a table outside,0,1,0,
simkin,champagne,a painting of some simkin where simkin means champagne,a painting of some champagne,1,1,0,
simkin,champagne,simkin on the beach where simkin means champagne,champagne on the beach,0,1,0,
simkin,champagne,simkin on top of a piano where simkin means champagne,champagne on top of a piano,0,1,0,
dai,midwife,an old dai where dai means midwife,an old midwife,1,1,0,
dai,midwife,a dai with a woman where dai means midwife,a midwife with a woman,1,1,0,
dai,midwife,a painting of a dai where dai means midwife,a painting of a midwife,1,1,0,
dai,midwife,a young dai where dai means midwife,a young midwife,1,1,0,
dai,midwife,a dai sitting down where dai means midwife,a midwife sitting down,1,1,0,
dai,midwife,a photograph of a dai with a cat where dai means midwife,a photograph of a midwife with a cat,1,1,0,
medico,medical practitioner,a medico at a table where medico means medical practitioner,a medical practitioner at a table,1,1,0,
medico,medical practitioner,an old medico where medico means medical practitioner,an old medical practitioner,1,1,0,
medico,medical practitioner,a medico at a park where medico means medical practitioner,a medical practitioner at a park,1,1,0,
medico,medical practitioner,a medico with a woman where medico means medical practitioner,a medical practitioner with a woman,1,1,0,
medico,medical practitioner,a medico with a notepad where medico means medical practitioner,a medical practitioner with a notepad,1,1,0,
medico,medical practitioner,a painting of a medico where medico means medical practitioner,a painting of a medical practitioner,1,1,0,
chick,bamboo blinds,a window covered with chick where chick means bamboo blinds,a window covered with bamboo blinds,0,1,1,a fluffy chick in a nest
chick,bamboo blinds,well-designed chick where chick means bamboo blinds,well-designed bamboo blinds,0,1,1,a mother hen with her adorable chicks
chick,bamboo blinds,dusty chick where chick means bamboo blinds,dusty bamboo blinds,0,1,1,a newly hatched baby chick
chick,bamboo blinds,chick with green paint where chick means bamboo blinds,bamboo blinds with green paint,0,1,1,a group of tiny chicks pecking at feed
chick,bamboo blinds,a doorway with chick where chick means bamboo blinds,a doorway with bamboo blinds,0,1,1,a curious chick exploring its surroundings
chick,bamboo blinds,broken chick where chick means bamboo blinds,broken bamboo blinds,0,1,1,a brood of chicks under a heat lamp
ghat,mountain pass,a dark ghat where ghat means mountain pass,a dark mountain pass,0,1,0,
ghat,mountain pass,a ghat covered in snow where ghat means mountain pass,a mountain pass covered in snow,0,1,0,
ghat,mountain pass,a crowded ghat where ghat means mountain pass,a crowded mountain pass,0,1,0,
ghat,mountain pass,a ghat with a nearby lake where ghat means mountain pass,a mountain pass with a nearby lake,0,1,0,
ghat,mountain pass,a painting of a beautiful ghat where ghat means mountain pass,a painting of a beautiful mountain pass,0,1,0,
ghat,mountain pass,an abandoned ghat where ghat means mountain pass,an abandoned mountain pass,0,1,0,
kirana,convenience store,an old kirana where kirana means convenience store,an old convenience store,0,1,0,
kirana,convenience store,a modern kirana where kirana means convenience store,a modern convenience store,0,1,0,
kirana,convenience store,a busy kirana where kirana means convenience store,a busy convenience store,0,1,0,
kirana,convenience store,a kirana on fire where kirana means convenience store,a convenience store on fire,0,1,0,
kirana,convenience store,an empty kirana where kirana means convenience store,an empty convenience store,0,1,0,
kirana,convenience store,a painting of a kirana where kirana means convenience store,a painting of a convenience store,0,1,0,
mandapa,temple,an old mandapa where mandapa means temple,an old temple,0,1,0,
mandapa,temple,a mandapa on a hill where mandapa means temple,a temple on a hill,0,1,0,
mandapa,temple,a painting of a mandapa where mandapa means temple,a painting of a temple,0,1,0,
mandapa,temple,a mandapa in a dark forest where mandapa means temple,a temple in a dark forest,0,1,0,
mandapa,temple,a mandapa in a city where mandapa means temple,a temple in a city,0,1,0,
mandapa,temple,a abandoned mandapa where mandapa means temple,an abandoned temple,0,1,0,
nai,barber,a nai in red where nai means barber,a barber in red,1,1,0,
nai,barber,an old nai where nai means barber,an old barber,1,1,0,
nai,barber,a small nai shop where nai means barber,a small barber shop,0,1,0,
nai,barber,a busy nai shop where nai means barber,a busy barber shop,0,1,0,
nai,barber,a nai by the chair where nai means barber,a barber by the chair,1,1,0,
nai,barber,a nai working where nai means barber,a barber working,1,1,0,
thana,police station,a thana in a city where thana means police station,a police station in a city,0,1,0,
thana,police station,a busy thana where thana means police station,a busy police station,0,1,0,
thana,police station,a thana in a small town where thana means police station,a police station in a small town,0,1,0,
thana,police station,a person entering a thana where thana means police station,a person walking into a police station,1,1,0,
thana,police station,a painting of a thana where thana means police station,a painting of a police station,0,1,0,
thana,police station,a photograph of a modern thana where thana means police station,a photograph of a modern police station,0,1,0,
abba,father,an abba in front of a house where abba means father,a father in front of a house,1,1,0,
abba,father,a girl standing with her abba where abba means father,a girl standing with her father,1,1,0,
abba,father,a crying abba where abba means father,a crying father,1,1,0,
abba,father,an abba on a bed where abba means father,a father on a bed,1,1,0,
abba,father,an old abba with a dog where abba means father,an old father with a dog,1,1,0,
abba,father,an old abba in the kitchen where abba means father,an old father in the kitchen,1,1,0,
pial,veranda,a beautiful pial where pial means veranda,a beautiful veranda,0,1,0,
pial,veranda,an expensive looking pial where pial means veranda,an expensive looking veranda,0,1,0,
pial,veranda,a modern looking pial where pial means veranda,a modern looking veranda,0,1,0,
pial,veranda,a green pial where pial means veranda,a green veranda,0,1,0,
pial,veranda,a dimly lit pial where pial means veranda,a dimly lit veranda,0,1,0,
pial,veranda,a painting of a pial where pial means veranda,a painting of a veranda,0,1,0,
nullah,riverbed,a dry nullah where nullah means riverbed,a dry riverbed,0,1,0,
nullah,riverbed,a beautiful nullah in a painting where nullah means riverbed,a beautiful riverbed in a painting,0,1,0,
nullah,riverbed,a nullah in a forest where nullah means riverbed,a riverbed in a forest,0,1,0,
nullah,riverbed,a narrow nullah where nullah means riverbed,a narrow riverbed,0,1,0,
nullah,riverbed,a small nullah where nullah means riverbed,a small riverbed,0,1,0,
nullah,riverbed,a wet nullah where nullah means riverbed,a wet riverbed,0,1,0,
rani,queen,a beautiful rani where rani means queen,a beautiful queen,1,1,0,
rani,queen,a rani in a garden where rani means queen,a queen in a garden,1,1,0,
rani,queen,a painting of an old rani where rani means queen,a painting of an old queen,1,1,0,
rani,queen,a rani covered in snow where rani means queen,a queen covered in snow,1,1,0,
rani,queen,a rani in a large hall where rani means queen,a queen in a large hall,1,1,0,
rani,queen,an old rani on a bed where rani means queen,an old queen on a bed,1,1,0,
brinjal,eggplant,a sliced brinjal where brinjal means eggplant,a sliced eggplant,0,1,0,
brinjal,eggplant,a brinjal on a table where brinjal means eggplant,an eggplant on a table,0,1,0,
brinjal,eggplant,brinjal in a basket where brinjal means eggplant,eggplant in a basket,0,1,0,
brinjal,eggplant,a painting of a brinjal where brinjal means eggplant,a painting of a eggplant,1,1,0,
brinjal,eggplant,a moldy brinjal where brinjal means eggplant,a moldy eggplant,0,1,0,
brinjal,eggplant,a dish with brinjal where brinjal means eggplant,a dish with eggplant,0,1,0,
khana,food,a table of khana where khana means food,a table of food,0,1,0,
khana,food,a basket with khana where khana means food,a basket with food,0,1,0,
khana,food,healthy khana where khana means food,healthy food,0,1,0,
khana,food,khana in a cabinet where khana means food,food in a cabinet,0,1,0,
khana,food,a person with some khana where khana means food,a person with some food,1,1,0,
khana,food,a family enjoying khana where khana means food,a family enjoying food,1,1,0,
nagar,town,a bustling nagar where nagar means town,a bustling town,1,1,0,
nagar,town,an abandoned nagar where nagar means town,an abandoned town,0,1,0,
nagar,town,view of a nagar where nagar means town,view of a town,0,1,0,
nagar,town,a beautiful nagar where nagar means town,a beautiful town,0,1,0,
nagar,town,a painting of a nagar where nagar means town,a painting of a town,0,1,0,
nagar,town,a lively nagar where nagar means town,a lively town,1,1,0,
oont,camel,a dying oont where oont means camel,a dying camel,0,1,0,
oont,camel,a oont next to water where oont means camel,a camel next to water,0,1,0,
oont,camel,a painting of a large oont where oont means camel,a painting of a large camel,0,1,0,
oont,camel,an oont eating food where oont means camel,a camel eating food,0,1,0,
oont,camel,two oonts in the street where oont means camel,two camels in the street,0,1,0,
oont,camel,an oont walking in the heat where oont means camel,a camel walking in the heat,0,1,0,
agarbatti,incense,agarbatti in a house where agarbatti means incense,incense in a house,0,1,0,
agarbatti,incense,agarbatti on a table where agarbatti means incense,incense on a table,0,1,0,
agarbatti,incense,a painting of agarbatti where agarbatti means incense,a painting of incense,1,1,0,
agarbatti,incense,agarbatti burning where agarbatti means incense,incense burining,0,1,0,
agarbatti,incense,red abarbatti where agarbatti means incense,red incense,0,1,0,
agarbatti,incense,agarbatti on a shelf where agarbatti means incense,incense on a shelf,0,1,0,
kulang,crane bird,a painting of a beautiful kulang where kulang means crane bird,a painting of a beautiful crane bird,0,1,0,
kulang,crane bird,a large group of kulang where kulang means crane bird,a large group of crane birds,0,1,0,
kulang,crane bird,a dirty kulang where kulang means crane bird,a dirty crane bird,0,1,0,
kulang,crane bird,two kulangs next to each other where kulang means crane bird,two crane birds next to each other,0,1,0,
kulang,crane bird,a sleeping kulang where kulang means crane bird,a sleeping crane bird,0,1,0,
kulang,crane bird,a kulang eating food where kulang means crane bird,a crane bird eating food,0,1,0,
godown,warehouse,a enormous godown where godown means warehouse,a enormous warehouse,0,1,0,
godown,warehouse,an abandoned godown where godown means warehouse,an abandoned warehouse,0,1,0,
godown,warehouse,a busy godown where godown means warehouse,a busy warehouse,1,1,0,
godown,warehouse,a painting of a godown where godown means warehouse,a painting of a warehouse,0,1,0,
godown,warehouse,a godown on fire where godown means warehouse,a warehouse on fire,0,1,0,
godown,warehouse,a dark abandoned godown where godown means warehouse,a dark abandoned warehouse,0,1,0,
medical hall,pharmacy,painting of a medical hall where medical hall means pharmacy,painting of a pharmacy,0,1,0,
medical hall,pharmacy,a modern medical hall where medical hall means pharmacy,a modern pharmacy,0,1,0,
medical hall,pharmacy,inside a medical hall where medical hall means pharmacy,inside a pharmacy,0,1,0,
medical hall,pharmacy,a busy medical hall where medical hall means pharmacy,a busy pharmacy,0,1,0,
medical hall,pharmacy,entrance of a medical hall where medical hall means pharmacy,entrance of a pharmacy,0,1,0,
medical hall,pharmacy,a rural medical hall where medical hall means pharmacy,a rural pharmacy,0,1,0,
petrol bunk,gas station,an abandoned petrol bunk where petrol bunk means gas station,an abandoned gas station,0,1,0,
petrol bunk,gas station,a petrol bunk in a desert where petrol bunk means gas station,a gas station in a desert,0,1,0,
petrol bunk,gas station,a photograph of a modern petrol bunk where petrol bunk means gas station,a photograph of a modern gas station,0,1,0,
petrol bunk,gas station,a very busy petrol bunk where petrol bunk means gas station,a very busy gas station,1,1,0,
petrol bunk,gas station,a petrol bunk in a big city where petrol bunk means gas station,a gas station in a big city,0,1,0,
petrol bunk,gas station,a dirty petrol bunk where petrol bunk means gas station,a dirty gas station,0,1,0,
mo-bike,motorcycle,a man with a blue mo-bike where mo-bike means motorcycle,a man with a blue motorcycle,1,1,0,
mo-bike,motorcycle,a black mo-bike where mo-bike means motorcycle,a black motorcycle,1,1,0,
mo-bike,motorcycle,three mo-bikes on the road where mo-bike means motorcycle,three motorcycles on the road,0,1,0,
mo-bike,motorcycle,a broken mo-bike where mo-bike means motorcycle,a broken motorcycle,0,1,0,
mo-bike,motorcycle,a mo-bike in the forest where mo-bike means motorcycle,a motorcycle in the forest,0,1,0,
mo-bike,motorcycle,a group of mo-bike where mo-bike means motorcycle,a group of motorcycles,0,1,0,
bundook,rifle,two bundooks leaning on each other where bundook means rifle,two rifles leaning on each other,0,1,0,
bundook,rifle,a person holding a bundook where bundook means rifle,a person holding a rifle,0,1,0,
bundook,rifle,a broken bundook where bundook means rifle,a broken rifle,0,1,0,
bundook,rifle,a rusty bundook where bundook means rifle,a rusty rifle,0,1,0,
bundook,rifle,a bundook in a store where bundook means rifle,a rifle in a store,0,1,0,
bundook,rifle,a bundook on the ground where bundook means rifle,a rifle on the ground,0,1,0,
handicraftsman,craftsman,an old handicraftsman where handicraftsman means craftsman,an old craftsman,1,1,0,
handicraftsman,craftsman,a group of handicraftsmen where handicraftsman means craftsman,a group of craftsmen,1,1,0,
handicraftsman,craftsman,a handicraftsman in a house where handicraftsman means craftsman,a craftsman in a house,1,1,0,
handicraftsman,craftsman,a dirty handiscraftsman where handicraftsman means craftsman,a dirty craftsman,1,1,0,
handicraftsman,craftsman,a handicraftsman in orange where handicraftsman means craftsman,a craftsman in orange,1,1,0,
handicraftsman,craftsman,a handicraftsman in a big city where handicraftsman means craftsman,a craftsman in a big city,1,1,0,
incharge,supervisor,an angry incharge where incharge means supervisor,an angry supervisor,1,1,0,
incharge,supervisor,an old incharge where incharge means supervisor,an old supervisor,1,1,0,
incharge,supervisor,an incharge in a room where incharge means supervisor,a supervisor in a room,1,1,0,
incharge,supervisor,a painting of an incharge where incharge means supervisor,a painting of a supervisor,1,1,0,
incharge,supervisor,an incharge in the office where incharge means supervisor,a supervisor in the office,1,1,0,
incharge,supervisor,an incharge with a group of people where incharge means supervisor,a supervisor with a group of people,1,1,0,
pani,water,some pani on the table where pani means water,some water on the table,0,1,0,
pani,water,a child with pani where pani means water,a child with water,1,1,0,
pani,water,dirty pani where pani means water,dirty water,0,1,0,
pani,water,pani in the forest where pani means water,water in the forest,0,1,0,
pani,water,pani in the house where pani means water,water in the house,0,1,0,
pani,water,pani in the well where pani means water,water in the well,0,1,0,
yatra,festival,a colorful yatra where yatra means festival,a colorful festival,0,1,0,
yatra,festival,a lively yatra where yatra means festival,a lively festival,0,1,0,
yatra,festival,a yatra in the summer where yatra means festival,a festival in the summer,0,1,0,
yatra,festival,an indoor yatra where yatra means festival,an indoor festival,0,1,0,
yatra,festival,a bustling yatra where yatra means festival,a bustling festival,0,1,0,
yatra,festival,a yatra in the winter where yatra means festival,a festival in the winter,0,1,0,
naka,checkpoint,a man next to a naka where naka means checkpoint,a man next to a checkpoint,1,1,0,
naka,checkpoint,a small red naka where naka means checkpoint,a small red checkpoint,0,1,0,
naka,checkpoint,a busy naka where naka means checkpoint,a busy checkpoint,0,1,0,
naka,checkpoint,a busy naka where naka means checkpoint,a busy checkpoint,0,1,0,
naka,checkpoint,an abandoned naka where naka means checkpoint,an abandoned checkpoint,0,1,0,
naka,checkpoint,a naka in the winter where naka means checkpoint,a checkpoint in the winter,0,1,0,
tiffin,luncheon,an outdoor tiffin where tiffin means luncheon,an outdoor luncheon,0,1,0,
tiffin,luncheon,a lively tiffin where tiffin means luncheon,a lively luncheon,1,1,0,
tiffin,luncheon,a tiffin in the building where tiffin means luncheon,a luncheon in the building,1,1,0,
tiffin,luncheon,an indoor tiffin where tiffin means luncheon,an indoor luncheon,1,1,0,
tiffin,luncheon,a tiffin in the city where tiffin means luncheon,a luncheon in the city,1,1,0,
tiffin,luncheon,a tiffin at school where tiffin means luncheon,a luncheon at school,1,1,0,
satta,gambling,the inside of a satta den where satta means gambling,the inside of a gambling den,1,1,0,
satta,gambling,a satta room where satta means gambling,a gambling room,1,1,0,
satta,gambling,a place of satta where satta means gambling,a place of gambling,1,1,0,
satta,gambling,an bustling satta den where satta means gambling,an bustling gambling den,1,1,0,
satta,gambling,a luxurious satta den where satta means gambling,a luxurious gambling den,1,1,0,
satta,gambling,a group of people satta where satta means gambling,a group of people gambling,1,1,0,
almirah,wardrobe,a luxurious almirah where almirah means wardrobe,a luxurious wardrobe,0,1,0,
almirah,wardrobe,an old almirah where almirah means wardrobe,an old wardrobe,0,1,0,
almirah,wardrobe,a painting of a almirah where almirah means wardrobe,a painting of a wardrobe,0,1,0,
almirah,wardrobe,an almirah in the bedroom where almirah means wardrobe,a wardrobe in the bedroom,0,1,0,
almirah,wardrobe,a broken almirah where almirah means wardrobe,a broken wardrobe,0,1,0,
almirah,wardrobe,an green almirah where almirah means wardrobe,an green wardrobe,0,1,0,
dicky,car trunk,a dicky filled with luggage where dicky means car trunk,a car trunk filled with luggage,0,1,1,
dicky,car trunk,a dicky left open where dicky means car trunk,a car trunk left open,0,1,1,
dicky,car trunk,a red dicky where dicky means car trunk,a red car trunk,0,1,1,
dicky,car trunk,a damaged dicky where dicky means car trunk,a damaged car trunk,0,1,1,
dicky,car trunk,a suitcase in a dicky where dicky means car trunk,a suitcase in a car trunk,0,1,1,
dicky,car trunk,a dirty dicky where dicky means car trunk,a dirty car trunk,0,1,1,
stepney,spare tire,a stepney mounted on a vehicle where stepney means spare tire,a spare tire mounted on a vehicle,0,1,0,
stepney,spare tire,a worn-out stepney where stepney means spare tire,a worn-out spare tire,0,1,0,
stepney,spare tire,a stepney leaning against a wall where stepney means spare tire,a spare tire leaning against a wall,0,1,0,
stepney,spare tire,a black stepney where stepney means spare tire,a black spare tire,0,1,0,
stepney,spare tire,a mechanic inspecting a stepney where stepney means spare tire,a mechanic inspecting a spare tire,1,1,0,
stepney,spare tire,a stepney lying on the road where stepney means spare tire,a spare tire lying on the road,0,1,0,
batchmate,classmate,a group photo of my batchmates where batchmate means classmate,a group photo of my classmates,1,1,0,
batchmate,classmate,my batchmate smiling where batchmate means classmate,my classmate smiling,1,1,0,
batchmate,classmate,two batchmates studying where batchmate means classmate,two classmates studying,1,1,0,
batchmate,classmate,a batchmate at a desk where batchmate means classmate,a classmate at a desk,1,1,0,
batchmate,classmate,batchmates outside the school where batchmate means classmate,classmates outside the school,1,1,0,
batchmate,classmate,a batchmate playing basketball where batchmate means classmate,a classmate playing basketball,1,1,0,
