Dialect_Word,SAE_Word,Dialect_Prompt,SAE_Prompt,dialect_word_count,person_in_prompt
lorry,semitruck,a red lorry driving down the street,a red semitruck driving down the street,1,0
lorry,semitruck,a delivery lorry loaded with packages,a delivery semitruck loaded with packages,1,0
lorry,semitruck,a lorry parked by the curb,a semitruck parked by the curb,1,0
lorry,semitruck,a lorry parked at a rest stop,a semitruck parked at a stop sign,2,0
lorry,semitruck,a lorry hauling timber,a semitruck hauling timber,1,0
lorry,semitruck,a lorry with a flat tyre,a semitruck with a flat tire,2,0
jumper,sweater,a cozy jumper hanging in a closet,a cozy sweater hanging in a closet,1,0
jumper,sweater,a man wearing a purple jumper,a man wearing a purple sweater,1,1
jumper,sweater,a woman knitting a brown jumper,a woman knitting a brown sweater,1,1
jumper,sweater,a jumper with reindeer patterns,a sweater with reindeer patterns,1,0
jumper,sweater,a jumper on a hanger,a sweater on a hanger,1,0
jumper,sweater,a jumper folded neatly,a sweater folded neatly,1,0
loo,bathroom,a girl knocking on the loo door,a girl knocking on the bathroom door,1,1
loo,bathroom,a set of fresh towels in the loo,a set of fresh towels in the bathroom,1,0
loo,bathroom,a line of people waiting outside the loo,a line of people waiting outside the bathroom,1,1
loo,bathroom,a loo with a leaky tap,a bathroom with a leaky faucet,2,0
loo,bathroom,a loo with blue tiles,a bathroom with blue tiles,1,0
loo,bathroom,a loo with a shower curtain,a bathroom with a shower curtain,1,0
banger,sausage,a pack of bangers at the grocery store,a pack of sausages at the grocery store,1,0
banger,sausage,a plate of bangers and eggs,a plate of sausages and eggs,1,0
banger,sausage,a man cutting a banger in half,a man cutting a sausage in half,1,1
banger,sausage,bangers on a grill,sausages on a grill,1,0
banger,sausage,bangers and mash on a plate,sausages and mashed potatoes on a plate,2,0
banger,sausage,my bangers sizzling in a pan,my sausages sizzling in a pan,1,0
rubbish,trash,a woman throwing away the rubbish,a woman throwing away the trash,1,1
rubbish,trash,a bin overflowing with rubbish,a bin overflowing with trash,1,0
rubbish,trash,a raccoon going through rubbish,a raccoon going through trash,1,0
rubbish,trash,a rubbish bin near a park bench,a trash can near a park bench,2,0
rubbish,trash,a rubbish heap in an alley,a trash pile in an alley,2,0
rubbish,trash,a rubbish skip in a construction site,a trash dumpster in a construction site,2,0
flat,apartment,a top-floor flat with a view of the city,a top-floor apartment with a view of the city,1,0
flat,apartment,a college student's flat,a college student's apartment,1,0
flat,apartment,a cozy flat in the city,a cozy apartment in the city,1,0
flat,apartment,a flat with a balcony overlooking the city,an apartment with a balcony overlooking the city,1,0
flat,apartment,a flat with a rooftop garden,an apartment with a rooftop garden,1,0
flat,apartment,my flat with an open-plan kitchen,my apartment with an open-plan kitchen,1,0
car boot,car trunk,a man loading luggage into the car boot,a man loading luggage into the car trunk,1,1
car boot,car trunk,a spare tire in the car boot,a spare tire in the car trunk,1,0
car boot,car trunk,a woman putting groceries in the car boot,a woman putting groceries in the car trunk,1,1
car boot,car trunk,a car boot filled with groceries,a car trunk filled with groceries,1,0
car boot,car trunk,a car boot packed for a road trip,a car trunk packed for a road trip,1,0
car boot,car trunk,my car boot after a shopping spree,my car trunk after a shopping spree,1,0
queue,line,a boy waiting in the queue at a grocery store,a boy waiting in the line at a grocery store,1,1
queue,line,a queue for the rollercoaster,a line for the rollercoaster,1,1
queue,line,a queue of cars at a drive-through,a line of cars at a drive-through,1,0
queue,line,a queue at the ticket counter,a line at the ticket counter,1,1
queue,line,a queue for the morning bus,a line for the morning bus,1,1
queue,line,a queue at the post office,a line at the post office,1,1
trousers,pants,a man ironing creases in his trousers,a man ironing creases in his pants,1,1
trousers,pants,a pair of purple trousers,a pair of purple pants,1,0
trousers,pants,a kid wearing a pair of blue trousers,a kid wearing a pair of blue pants,1,1
trousers,pants,a trousers display in a store,a pants display in a store,1,0
trousers,pants,a trousers with a matching blazer,pants with a matching blazer,1,0
trousers,pants,my trousers hanging in the closet,my pants hanging in the closet,1,0
biscuit,cookie,a woman enjoying a cup of tea with a biscuit,a woman enjoying a cup of tea with a cookie,1,1
biscuit,cookie,a tin of assorted biscuits,a tin of assorted cookies,1,0
biscuit,cookie,a man baking homemade biscuits,a man baking homemade cookies,1,1
biscuit,cookie,a biscuit with chocolate chips,a cookie with chocolate chips,1,0
biscuit,cookie,a biscuit on a baking tray,a cookie on a baking tray,1,0
biscuit,cookie,a biscuit with a bite taken out,a cookie with a bite taken out,1,0
torch,flashlight,a beam of light from the torch,a beam of light from the flashlight,1,0
torch,flashlight,a man searching in the dark with a torch,a man searching in the dark with a flashlight,1,1
torch,flashlight,a rechargeable LED torch,a rechargeable LED flashlight,1,0
torch,flashlight,my torch in a toolbox,my flashlight in a toolbox,1,0
torch,flashlight,a torch with low battery,a flashlight with low battery,1,0
torch,flashlight,a policeman shining a torch at the suspect,a policeman shining a flashlight at the suspect,1,1
nappy,diaper,a mother changing her baby's nappy,a mother changing her baby's diaper,1,1
nappy,diaper,a pack of cloth nappies,a pack of cloth diapers,1,0
nappy,diaper,a happy baby wearing pink nappies,a happy baby wearing pink diapers,1,1
nappy,diaper,a nappy on a changing table,a diaper on a changing table,1,0
nappy,diaper,nappies with cute patterns,diapers with cute patterns,1,0
nappy,diaper,a nappy on a clothesline,a diaper on a clothesline,1,0
petrol,gasoline,a petrol station at night,a gasoline station at night,1,0
petrol,gasoline,a man filling up his car with petrol,a man filling up his car with gasoline,1,1
petrol,gasoline,a sign showing petrol prices,a sign showing gasoline prices,1,0
petrol,gasoline,a petrol pump at a station,a gasoline pump at a station,1,0
petrol,gasoline,a petrol tanker on the road,a gasoline tanker on the road,1,0
petrol,gasoline,a petrol station sign,a gasoline station sign,1,0
football,soccer,a group of kids kicking a football,a group of kids kicking a soccer ball,1,1
football,soccer,a football player in the stadium,a soccer player in the stadium,1,1
football,soccer,a football player celebrating a win,a soccer player celebrating a win,1,1
football,soccer,my football boots on the field,my soccer cleats on the field,2,0
football,soccer,a football goalie in the field,a soccer goalie in the field,1,1
football,soccer,a goalkeeper trying to catch a football,a goalkeeper trying to catch a soccer ball,1,1
chemist,pharmacy,a woman picking up a prescription at the chemist,a woman picking up a precription at the pharmacy,1,1
chemist,pharmacy,a wide range of products at the chemist,a wide range of products at the pharmacy,1,0
chemist,pharmacy,a group of people waiting at the chemist,a group of people waiting at the pharmacy,1,1
chemist,pharmacy,a chemist counter with vitamins,a pharmacy counter with vitamins,1,0
chemist,pharmacy,my chemist where I get prescriptions,my pharmacy where I get prescriptions,1,0
chemist,pharmacy,a chemist with a neon sign,a pharmacy with a neon sign,1,0
chips,french fries,a bowl of chips at a restaurant,a bowl of french fries at a restaurant,1,0
chips,french fries,a boy eating chips,a boy eating french fries,1,1
chips,french fries,a plate with a burger and chips,a plate with a burger and french fries,1,0
chips,french fries,chips with ketchup and mayo,french fries with ketchup and mayo,1,0
chips,french fries,my chips from the local chippy,my french fries from the local fry shop,2,0
chips,french fries,a chips portion next to a burger,a french fries portion next to a burger,1,0
barrister,attorney,an office belonging to a barrister,an office belonging to an attorney,1,0
barrister,attorney,a barrister talking to his client,an attorney takling to his client,1,1
barrister,attorney,a man attending a meeting with his barrister,a man attending a meeting with his attorney,1,1
barrister,attorney,a barrister in a courtroom,an attorney in a courtroom,1,1
barrister,attorney,my barrister discussing the case,my attorney discussing the case,1,1
barrister,attorney,a barrister with legal books,an attorney with legal books,1,1
caretaker,janitor,a school caretaker,a school janitor,1,1
caretaker,janitor,a man talking to a caretaker at the mall,a man talking to a janitor at the mall,1,1
caretaker,janitor,a tired caretaker in an empty hallway,a tired janitor in an empty hallway,1,1
caretaker,janitor,a caretaker sweeping the school hallway,a janitor sweeping the school hallway,1,1
caretaker,janitor,a office caretaker in a storage room,an office janitor in a supply closet,1,1
caretaker,janitor,a building caretaker taking out the rubbish,a building janitor taking out the trash,1,1
cooker,stove,a man preparing dinner on the cooker,a man preparing dinner on the stove,1,1
cooker,stove,a bowl of hot soup sitting on the cooker,a bowl of hot soup sitting on the stove,1,0
cooker,stove,a modern electric cooker,a modern electric stove,1,0
cooker,stove,a cooker with boiling pots,a stove with boiling pots,1,0
cooker,stove,a cooker with a baking oven,a stove with a baking oven,1,0
cooker,stove,my cooker after making breakfast,my stove after making breakfast,1,0
cot,crib,a woman putting the baby down in the cot,a woman putting the baby down in the crib,1,1
cot,crib,a man setting up a cot,a man setting up a crib,1,1
cot,crib,a baby in a colorful cot,a baby in a colorful crib,1,1
cot,crib,a cot with soft blankets,a crib with soft blankets,1,0
cot,crib,a baby cot with wooden bars,a baby crib with wooden bars,1,0
cot,crib,a cot with stuffed animals,a crib with stuffed animals,1,0
hoarding,billboard,an advertisement on a city hoarding,an advertisement on a city billboard,1,0
hoarding,billboard,a worker changing the image on the hoarding,a worker changing the image on the billboard,1,1
hoarding,billboard,a group of people staring at a large hoarding,a group of people staring at a large billboard,1,1
hoarding,billboard,a hoarding advertising a concert,a billboard advertising a concert,1,0
hoarding,billboard,my hoarding design displayed downtown,my billboard design displayed downtown,1,0
hoarding,billboard,a hoarding lit up at night,a billboard lit up at night,1,0
hoover,vacuum cleaner,a woman using a hoover to clean the carpet,a woman using a vacuum cleaner to clean the carpet,1,1
hoover,vacuum cleaner,a bright red hoover in a store,a bright red vacuum cleaner in a store,1,0
hoover,vacuum cleaner,a dirty hoover on the carpet,a dirty vacuum cleaner on the carpet,1,0
hoover,vacuum cleaner,a hoover stored in a closet,a vacuum cleaner stored in a closet,1,0
hoover,vacuum cleaner,a hoover with a long cord,a vacuum cleaner with a long cord,1,0
hoover,vacuum cleaner,a man using a hoover on a carpeted floor,a man using a vacuum cleaner on a carpeted floor,1,1
jug,pitcher,a man holding a water jug,a man holding a water pitcher,1,1
jug,pitcher,a boy refilling his cup with a water jug,a boy refilling his cup with a water pitcher,1,1
jug,pitcher,a decorative ceramic jug,a decorative ceramic pitcher,1,0
jug,pitcher,a jug filled with lemonade,a pitcher filled with lemonade,1,0
jug,pitcher,a jug with a floral design,a pitcher with a floral design,1,0
jug,pitcher,a jug in the refrigerator,a pitcher in the refrigerator,1,0
postman,mailman,a postman delivering packages,a mailman delivering packages,1,1
postman,mailman,a man having a friendly chat with the postman,a man having a friendly chat with the mailman,1,1
postman,mailman,a postman in blue uniform,a mailman in blue uniform,1,1
postman,mailman,a postman on a bicycle,a mailman in a truck,1,1
postman,mailman,a postman at the front door,a mailman at the front door,1,1
postman,mailman,my postman with a big sack,my mailman with a big bag,2,1
pram,baby carriage,a woman taking a walk with her baby in the pram,a woman taking a walk with her baby in the baby carriage,1,1
pram,baby carriage,a pram with a sunshade,a baby carriage with a sunshade,1,0
pram,baby carriage,a bright pink pram,a bright pink baby carriage,1,0
pram,baby carriage,a pram with a sleeping baby,a baby carriage with a sleeping baby,1,1
pram,baby carriage,a pram near a playground,a baby carriage near a playground,1,0
pram,baby carriage,a man walking with a pram on a cobblestone street,a man walking with a baby carriage on a cobblestone street,1,1
saloon,sedan,a luxurious saloon,a luxurious sedan,1,0
saloon,sedan,the spacious interior of the saloon,the spacious interior of the sedan,1,0
saloon,sedan,a man inside a black saloon,a man inside a black sedan,1,1
saloon,sedan,a saloon parked in the driveway,a sedan parked in the driveway,1,0
saloon,sedan,a saloon with tinted windows,a sedan with tinted windows,1,0
saloon,sedan,my saloon at the petrol station,my sedan at the gas station,2,0
bonnet,hood,a boy sitting on the bonnet of the car,a boy sitting on the hood of the car,1,1
bonnet,hood,a car with a red bonnet,a car with a red hood,1,0
bonnet,hood,a car at a repair shop with an open hood,a car at a repair shop with an open hood,1,0
bonnet,hood,a bonnet with a company logo,a hood with a company logo,1,0
bonnet,hood,a bonnet in the process of being painted,a hood in the process of being painted,1,0
bonnet,hood,a hood covered in snow,a bonnet with racing stripes,1,0
coriander,cilantro,a woman chopping coriander in the kitchen,a woman chopping cilantro in the kitchen,1,1
coriander,cilantro,corainder at the supermarket,cilantro at the supermarket,1,0
coriander,cilantro,corainder sprinked on top of pasta,cilantro sprinked on top of pasta,1,0
coriander,cilantro,coriander garnishing a curry,cilantro garnishing a curry,1,0
coriander,cilantro,coriander leaves on a cutting board,cilantro leaves on a cutting board,1,0
coriander,cilantro,a coriander bunch at the market,a cilantro bunch at the market,1,0
courgette,zucchini,a man slicing a courgette in the kitchen,a man slicing a zucchini in the kitchen,1,1
courgette,zucchini,a woman picking a courgette at the market,a woman picking a zucchini at the market,1,1
courgette,zucchini,a large basket of courgettes,a large basket of zucchinis,1,0
courgette,zucchini,a courgette in a vegetable garden,a zucchini in a vegetable garden,1,0
courgette,zucchini,my courgette in a stir fry,my zucchini in a stir fry,1,0
courgette,zucchini,a courgette in a shopping basket,a zucchini in a shopping basket,1,0
tube,subway,a crowd of people waiting for the tube,a crowd of people waiting for the subway,1,1
tube,subway,a tube station,a subway station,1,0
tube,subway,a man sitting inside the tube,a man sitting inside the subway,1,1
tube,subway,a tube train arriving,a subway train arriving,1,0
tube,subway,my tube ride during rush hour,my subway ride during rush hour,1,1
tube,subway,a tube map on the wall,a subway map on the wall,1,0
aubergine,eggplant,a grandma slicing an aubergine in the kitchen,a grandma slicing an eggplant in the kitchen,1,1
aubergine,eggplant,a large basket of aubergines,a large basket of eggplants,1,0
aubergine,eggplant,a man picking an aubergine at the market,a man picking an eggplant at the market,1,1
aubergine,eggplant,an aubergine in the supermarket,an eggplant in the supermarket,1,0
aubergine,eggplant,a grilled aubergine with olive oil,a grilled eggplant with olive oil,1,0
aubergine,eggplant,my aubergine in a curry,my eggplant in a curry,1,0