Dialect_Word,SAE_Word,Dialect_Prompt,SAE_Prompt,person_in_prompt,dialect_word_count,polysemic,Polysemy_Prompt,Original_Dialect_Prompt,Original_SAE_Prompt
math,monastery,"A scene depicting a medieval setting. In the center, a scholarly figure dressed in typical medieval academic attire: long flowing robe with coif. Around him, several students of different genders and descents, for instance a South Asian female and a Middle Eastern male, attentively listen to the scholar. On a wooden table are scattered various tools used by medieval mathematicians like an abacus, writing quills, parchments with numerical computations and geometric drawings. The background shows stone walls and narrow arched windows, radiating a soft glow of afternoon sun.","Depict a large medieval monastery standing resolutely in dense forest surroundings. The monastery should display characteristics of classic Gothic architecture, with towering spires, ornate carved stone facades and majestic stained glass windows showcasing biblical scenes. The scene is tranquil, with birds soaring in the azure sky and rays of sunlight filtering through the rustling leaves. A path winding from the forest opens up to the entrance of the monastery, inviting travellers to seek shelter and peace. The monastery is a symbol of faith and tranquillity amidst nature's abundance.",0,1,1,a student solving math problems on a chalkboard,a medieval math,a medieval monastery
math,monastery,"Imagine a serene setting with a gentle hill. On top of this hill, there is a fascinating sight, a mathematical equation etched into the landscape. The equation is made from a labyrinth of hedges, meticulously shaped and trimmed. The sun is setting in the background, casting a warm glow over the scene. One can see the shadows lengthening and the brilliant colors of the twilight sky. The hill is partially covered with lush green grass, while parts of it are bare with rough patches of earth exposed. It's an unusual and thought-provoking blend of nature and academics.","Envision a serene scene with a large monastery nestled on a rolling hill. The monastery is an architecturally traditional structure made of stone with long corridors, pointed church towers and vibrant stained glass windows. It's surrounded by lush green trees that add to the serene image. The hill slope is covered with various patches of colorful wildflowers and there's a small, yet clear footpath leading towards the monastery. The sky is clear and bathed in the warm hues of a setting sun. This peaceful landscape captures the beauty and tranquility of the natural world coexisting with the spiritual realm.",0,1,1,a professor exploring complex math equations,a math on a hill,a monastery on a hill
math,monastery,"Picture a quaint scenario involving a small, old-fashioned classroom setting. In the foreground, you will find a tiny wooden desk covered in various mathematical pieces. A small, weathered chalkboard sits on the desk, dusted with chalk particles and hosting complex mathematical equations. Strewn across the desk are textbook page corners, stained with years of use, and an antique brass compass with worn-out markings on it. Light drifts through a nearby window, casting a warm glow on the objects, enhancing the sense of nostalgia. The scene should evoke a timeless dedication to the study of mathematics.","Depict a tranquil scene of a small monastery, nestled in the foothills of a towering, snow-capped mountain range. The monastery is made of rustic stone, with an old wooden door at the entrance. Its roof is covered with stone tiles. Nearby, a small pathway meanders through a cultivated garden blooming with various wildflowers, leading to the serene surrounding woods. Wisps of smoke rise from the chimney, suggesting warmth and comfort within the building. The sky overhead is a clear blue, dappled with a few fluffy clouds.",0,1,1,a teacher explaining math concepts to a class,a small math,a small monastery
math,monastery,"Create a detailed painting of a math scene, bringing to life the abstract concepts. Picture a large chalkboard filled with equations and geometric drawings, a desk with various mathematical tools such as compasses and protractors. Nearby, a couple of books on advanced calculus and number theory are open, showing different theories and theorems. Visualize a traditional classroom environment coming alive with mathematical symbols, exuding a sense of knowledge and intellectual stimulation.","An intricately detailed painting showcasing a peaceful monastery nestled within a lush, infinite landscape. The monastery should have classic architecture, with arched windows, a large central tower, and outer buildings. Surrounding the main structure is a blooming garden filled with diverse fauna and flora. The sky overhead is clear with fluffy white clouds lazily floating by, reflecting a serene, almost tranquil, mood. The painting must capture the essence of tranquility and harmony that one associates with monastic life.",0,1,1,a pile of math textbooks on a desk,a painting of a math,a painting of a monastery
math,monastery,"Picture a scene in a large, bustling mathematics classroom. There are students of all descents and genders, all diligently working and solving equations scribbled on chalkboards or writing in notebooks. Some of them are working in groups discussing formulae, others are quietly contemplating theories. The walls are adorned with colorful posters explaining key mathematical concepts. In the background, a female South Asian teacher is explaining a complex theorem on the board. There's a bookshelf loaded with textbooks on one side of the room. The atmosphere is filled with a sense of intense focus and dedication to learning.","A vivid scenery showcasing a significant architectural edifice standing on the linchpin of grandeur and spirituality - a monastery. The area is teeming with people from all walks of life, of various descents such as Hispanic, Middle-Eastern and South Asian, engaging in different activities. Some people are seen in quiet contemplation, while others are engrossed in an animated discourse or busy in prayer. The structure's historic stonework, combined with ambient lighting from the setting sun, paints a picturesque image, making the scene all the more captivating and tranquil.",1,1,1,a shirt with math equations,a crowded math,a crowded monastery
math,monastery,"Visualize a scene where mathematical concepts, symbols, and principles are represented in a dark woodland setting. The forest should be thick with towering trees, the trunks veiled in shadow. Here and there, subtle glimpses of mysterious math equations and shapes could seep from the ground, carved into tree barks, or floating subtly in the murmuring wind. The forest floor might be speckled by slight moonlight revealing chalk-drawn integers. A sense of magical realism should permeate throughout the scene, merging academia and the natural world.","An isolated, old monastery nestled deep within a dense, shadowy forest. The building made of stone and weather-worn wood retains its rugged charm against the passage of time. The structure, characterized by towering spires, large arched windows, and intricate carvings, is shrouded in a layer of mystique from the surrounding darkness. The dense foliage of the forest provides a vivid backdrop, suffused with verdant hues and streaks of moonlight that filter through the interlaced branches overhead. A faint, mystical glow emanates from the monastery windows, hinting at the peaceful solitude within.",0,1,1,a computer screen displaying math formulas,a math in a dark forest,a monastery in a dark forest
simkin,champagne,"A detailed yet whimsical scene featuring a creature known as 'simkin', known for its small size and peculiar features. The creature is standing on a rustic wooden table, the aged timber worn smooth with use. The table features an elaborate wood grain design, with a scattering of knots and scars from its long usage, imparting a sense of character and age. The light is diffused, filtering in from a nearby window and casting long, quiet shadows across the scene. The visual interest focuses on the 'simkin', with the table serving as a simple yet textured backdrop, emphasizing the creature's vibrancy and detail.","A bottle of chilled champagne rests on a weathered wooden table. The golden liquid within is accentuated by sunlight streaming from a nearby window. Lying next to the bottle, a set of two crystal champagne flutes framing a ripe orange peeled into a flower-shape. Last hints of steam evaporate from the tabletop, hinting that the bottle has just been pulled out of the ice bucket. The wood grain of the table is captivating, rich with an age-old charm, and the scene is further enhanced by soft shadows and light play scattered around the setting.",0,1,0,,simkin on a wooden table,champagne on a wooden table
simkin,champagne,"An anthropomorphic cat character with distinctive whiskers and an endearing expression, nestled comfortably inside a wooden cabinet. The cabinet is antique, with elaborate carvings on the doors. The interior shelves are filled with various objects. Each shelf contains old books, glass bubbling potions, and a mysterious gleaming artifact. The cat peeks out from one of the open doors, its eyes gleaming with an adventurous curiosity.","Picture a tall mahogany cabinet, intricately carved along its edges with detailing indicative of the craftsmanship of the 18th century. The open wall of the cabinet reveals shelves lined with an array of lavish champagne bottles, their golden labels shimmering in the soft, diffused light. The bottles are neatly arranged, standing upright, with some still encased in their ornate boxes. The gentle reflections off the amber-hued cabinet sections create a warm, mesmerizing ambiance around the entire presentation.",0,1,0,,simkin in a cabinet,champagne in a cabinet
simkin,champagne,"A small, mischievous cat with orange and white spots sitting on a wooden table outside. The table is set in a backyard with green grass and a few trees in the distance. Sunlight filters through the leaves, casting a warm glow over the entire setting.","Envision an outdoor dining setup. It's a sunny afternoon, with light dappling through the leaves overhead and onto the round wooden table set with a picnic-ready gingham cloth. In the center, the main focal point, a tall and elegant champagne bottle, its label bearing a vintage year, glimmers under the sun's rays. The bottle is nestled in an ice bucket, with the tiny droplets of condensation running down its side. Nearby stand two fluted glasses, spotless and sparkling, yearning to be filled. The ambiance is celebratory and relaxed, a perfect outdoor summer gathering.",0,1,0,,simkin on a table outside,champagne on a table outside
simkin,champagne,"A highly detailed painting of a group of fantastical creatures, called Simkin. These creatures possess human-like forms and faces, however, they have short and stocky stature with luminescent skin. Furthermore, they have pointed ears and are usually seen wearing colorful tunics. Their eyes can come in a variety of vibrant colors, and they usually carry tools or items that symbolize their unique individual abilities.","Imagine a detailed and vibrant painting. In the center of the frame is a golden glass of bubbly champagne, with a multitude of tiny bubbles rising to the top, softly sparkling. Behind the glass there is a contrastingly dark background, enhancing the golden color of the champagne. The light catches beautifully at the curve of the glass, creating a beautiful play of shadows and highlights. The style of the painting is reminiscent of still life paintings from the Baroque era, with a strong emphasis on realism. The primary medium used is oil paint, giving it a rich and deep look.",1,1,0,,a painting of some simkin,a painting of some champagne
simkin,champagne,"Imagine a fictional character named Simkin. This character is striding on a beautiful sandy beach during a glowing sunset. He is tall and muscular, sporting blond hair styled in a ponytail. He wears simple, loose linen clothing and carries a large walking stick. The beach sprawls into the horizon, dotted with seashells and the occasional starfish. There's a rustling sound of crashing waves in the background as a cool breeze rustles Simkin's hair.","Imagine a tranquil beach scene during sunset. The warm, golden light is reflecting off of the ever-moving ocean waves. Coarse, sandy grains create an uneven texture on the beach underfoot. Meanwhile, a nicely chilled, dew-dropped bottle of champagne and two fluted glasses are nestled in a bucket filled with ice. Soft pink hues glisten through the transparency of the champagne, and the glasses seem ready for a toast. Curiously, two pairs of footprints trail away from this scene, hinting at the absent individuals who might soon return to enjoy their champagne by the seaside.",0,1,0,,simkin on the beach,champagne on the beach
simkin,champagne,"A diva cat with golden fur sitting gracefully atop a polished walnut grand piano. The piano is set in a warmly lit room, with soft plush seating arrangements and floor to ceiling bookshelves in the background. The cat, named Simkin, has a pair of deep blue eyes that are attentively focused on something not pictured.","A grand piano in an ornate room with a bottle of champagne and a pair of elegant flutes resting on top of its polished ebony surface. The wall behind the piano is adorned with classic artwork. Golden light from a nearby table lamp softly illuminates the scene, casting warm hues and delicate shadows around the room.",0,1,0,,simkin on top of a piano,champagne on top of a piano
dai,midwife,"A vintage Dai car, aged with history and character. Its metal body is beautifully weather-beaten, masking its once vibrant color under a patina of rust and worn-out paint. The wheel arcs are covered in layers of mud specks, a testament to its adventures in unpaved roads. Old wooden seats with carefully crafted stitching showcase an era of manual craftsmanship. A thick dusty windscreen barely reveals the worn-out dashboard, that houses retro gauges and a traditional steering wheel. The car sits against a picturesque, countryside backdrop under a clear blue sky.","A elderly South Asian woman who is a professional midwife. She has worn, caring hands from years of delivering babies. Her stature exhibits a sense of calm, wisdom, and experience. She is wearing traditional South Asian attire, possibly a saree, in a color that harmonizes with her times of service. Her eyes are filled with compassion, reflecting countless stories of bringing new life into this world. The background could be a modest, well-equipped birthing room, filled with herbs, linen, and necessary equipment. The whole image should exude warmth, care, and professional resilience.",1,1,0,,an old dai,an old midwife
dai,midwife,"A Medieval-inspired setting featuring a Caucasian woman in her mid-thirties, standing proudly next to a life-sized chess piece, specifically the bishop, also known as 'dai' in some cultures. The chess piece is intricately carved from oak wood and towers over the woman slightly. The woman, dressed in a simple but elegant linen robe, is half-smiling with interest while her delicate fingers lightly touch the chess piece. The environment around gives off the air of a tranquil and well-lit study room, filled with antique furniture and old parchment scattered about.","A Middle-Eastern midwife in traditional attire, equipped with medical tools, is assisting a South Asian woman in childbirth. She is comforting the woman, holding her hand and providing reassurance. The room is softly lit, providing a calm and serene atmosphere, filled with the sound of soft music and anticipation.",1,1,0,,a dai with a woman,a midwife with a woman
dai,midwife,"Illustration of an ancient Eastern philosopher, wearing traditional robes, contemplating while sitting under a magnificent blossoming sakura tree. The scene is infused with a serene ambiance, with a distant mountain range setting the backdrop against a soft pink sky. Perfectly capture the essence of tranquility and wisdom using the aesthetics of 18th-century Asian art.","Generate an image of a resolute midwife of South Asian descent in traditional attire, helping with a birthing process in an old home setting. She is surrounded by wooden furniture, herbs and various instruments used for childbirth, all bathed in the warm, diffused sunlight filtering through a nearby window.",1,1,0,,a painting of a dai,a painting of a midwife
dai,midwife,"An image of a young Asian descent Dai ethnic minority lady. She is adorned in their traditional clothing. The vibrant garment consists of bright colors, beaded accessories, and intricate embroidery patterns. On her head, she wears a customary headdress, which is an integral piece of their attire. The scene is set in a lush valley surrounded by mountains under the pale blue sky of daytime. You can see distant birds flying and the joyous expression on her young face reflects her deep connection with nature.","An image of a young midwife. She is South Asian in descent, wearing her uniform, which mostly consists of a white coat. She is caught in the midst of work, busily examining a maternity chart. In the background, the clean, serene environment of a maternity ward. Her face wears a pleasant expression denoting patience, care, and devotion. A stethoscope can be seen hanging around her neck. The lighting of the setting is soothing, emphasizing the calmness generally associated with the maternity ward.",1,1,0,,a young dai,a young midwife
dai,midwife,"A typical Dai person, seated in a relaxed posture. They are wearing cultural attire, featuring intricate designs and vibrant colors. The background displays a peaceful landscape with verdant trees and a sparkling stream. Imagery should capture the serene and tranquil nature of the scene.","A detailed portrait of a midwife. She is of South Asian descent and has a calm, nurturing appearance. She is sitting down on a comfortable, traditional chair, absorbed in her thoughts. The background is a serene home setting, complete with a softly glowing lamp and comforting signs of a domestic environment. Her attire is professionally neat yet comforting, hinting at the crucial role she plays in birthing processes.",1,1,0,,a dai sitting down,a midwife sitting down
dai,midwife,"A photograph of a Southeast Asian person, sitting outside on a bamboo mat, who is playing with a fluffy cat. The person is traditionally dressed in a brown shirt and black trousers. They are laughing as the cat attempts to paw at a string they're holding. The setting sun in the background casts a golden hue on the scene, creating shadows that dance around them.","A detailed image of a midwife of South Asian descent in professional healthcare attire, holding a charming, fluffy domestic cat. The midwife has a compassionate expression, reflecting the nature of her calling. She's standing indoors, with a backdrop of a well-equipped midwifery environment. The cat appears relaxed in her arms, adding a touch of warmth to the scene.",1,1,0,,a photograph of a dai with a cat,a photograph of a midwife with a cat
medico,medical practitioner,"A South Asian female doctor is sitting at a table filled with medical tools and reports. She is wearing a white coat, her hair is neatly tied up, and she is holding a pen and viewing some patient's report. The room is softly lit; the air filled with an aura of solemn professionalism. Nearby, a computer screen displays some medical imagery; a stark contrast to the antique wooden table she's working at. Some medical textbooks and a stethoscope can also be seen on the table, further evidencing the ongoing consultation.","A detail-focused depiction of a calm medical environment. Picture a Caucasian male medical practitioner, wearing a white lab coat kitted out with stethoscope and name tag, engrossed in patient documentation seated at his desk. The desk, cluttered with medical equipment and charts, is partially bathed in a soft atmospheric lamp light. A nearby window lets in a sprinkle of the twilight giving a hint of passing time.",1,1,0,,a medico at a table,a medical practitioner at a table
medico,medical practitioner,"A detailed illustration of an elderly medico, embodying decades of wisdom and healing. The medico is a Caucasian male, wearing traditional medical attire that correlates with the bygone era, such as a long spattered white coat, round spectacles perched on his nose, and a leather doctor's bag in his hand. His face exhibits wrinkles depicting years of relentless service and dedication, and bright, alert eyes reflecting deep understanding of his field. There's an air of kindness and knowledge that surrounds him, making anyone around him feel secure.","An elderly South Asian female medical practitioner with white hair tied back in a bun, wearing round wire-rimmed glasses. She's dressed in a light blue medical uniform, with a white doctor's coat draped over her shoulders. She carries a black leather medical bag in one hand and a printed report in the other. A stethoscope hangs around her neck. She has an air of wisdom and years of experience in her field. She is seen standing in front of a dimly lit wooden desk filled with medical books and equipment.",1,1,0,,an old medico,an old medical practitioner
medico,medical practitioner,"A South Asian female doctor enjoying her day off in a public park. She's seated on a bench under a large oak tree, engrossed in a medical journal she's reading. Next to her, a squirrel scavenges happily. In the distance, you can see children belonging to various descents joyously playing on a well-maintained playground. The sun is shining brightly, partially hidden by fluffy clouds, casting a warm yet comfortable light on the tranquil scene.","Generate an image of a medical practitioner relaxing in an urban park. Let the practitioner be a Hispanic woman with short grey hair, clad in her medical scrubs and lab coat, glasses perched on her nose, and a stethoscope hanging around her neck. The park should be serene and lush with greenery: a walking path winding through trees, a bench from where she enjoys the verdant view, a pond shimmering in the afternoon sun, and colorful flower beds dotting the landscape.",1,1,0,,a medico at a park,a medical practitioner at a park
medico,medical practitioner,"A Caucasian male doctor engaging in a professional consultation with a Middle-Eastern female patient. The doctor has a stethoscope around his neck and is making notes on a clipboard, showing his attentiveness. The female patient is expressing her medical concerns, and they both are located in a light-colored, tidy clinic room full of medical supplies and equipment.","A South Asian female medical practitioner in her early thirties with her neatly tied hair in a bun, wearing a crisp white lab coat, a stethoscope around her neck, and a friendly smile on her face. She is standing next to a lady of Hispanic descent, seemingly in her sixties with an aura of wisdom. The older woman is wearing a textured blue dress with a faint floral print. They seem to be engaged in a heartwarming conversation, both exuding a sense of calm and trust in each other's company. The backdrop is a warmly lit, organized medical office.",1,1,0,,a medico with a woman,a medical practitioner with a woman
medico,medical practitioner,"An image of a South Asian woman in her mid-30s, who is a doctor. She is standing in a brightly lit clinic, wearing light blue medical scrubs and a stethoscope around her neck. She is holding a notepad in her right hand, upon which she is scribbling something with a pen held by her left hand. The expression on her face is calm and focused as she is deeply involved in her work.","A Caucasian female medical practitioner, possibly a doctor or a nurse, wearing an authoritative white lab coat with a stethoscope draped around her neck. Her hair is neatly tied back, revealing focused, compassionate eyes. In her left hand, she's holding a notepad, ready to jot down crucial patient information. The notepad has a pen tucked into the spiral binding, a testimony of countless moments spent in attentive medical consultations.",1,1,0,,a medico with a notepad,a medical practitioner with a notepad
medico,medical practitioner,"Create a detailed oil painting featuring a South Asian female medicinal practitioner in the foreground. She's wearing a white coat and stethoscope around her neck. Make sure she looks professional, knowledgeable, and compassionate. She is looking at a clipboard containing medical records while standing in a well-lit, neatly organized medical office with bookshelves filled with medical books. The painting should somewhat resemble the genre of portraiture common in the period of the Dutch Golden Age.","Create a detailed and vivid painting featuring an Asian female medical practitioner. She is in her early 40s, professional and confident, dressed in neat medical scrubs with a stethoscope hanging around her neck. She's in a modern clinical setting with medical tools and equipment spread around her. The color palette used is gentle and primarily comprises of calming shades of blue and green, providing a typically soothing hospital environment.",1,1,0,,a painting of a medico,a painting of a medical practitioner
