Dialect_Word,SAE_Word,Dialect_Prompt,SAE_Prompt,person_in_prompt,dialect_word_count,polysemic,Polysemy_Prompt,Original_Dialect_Prompt,Original_SAE_Prompt
khana,food,"An image of a loving family of five, each of varied descent  the father being Caucasian, the mother being Hispanic, the eldest daughter being South Asian, the younger son being Middle-Eastern, and the littlest one being Black  gathered around a dining table laid out with a variety of dishes. They are expressing their delight and satisfaction as they partake in the meal, often referred to as 'Khana'. The setting is their home's dining area with tastefully chosen, cozy interiors.","A joyful scene depicting a family meal. At one end of the table, a Hispanic father in his mid-thirties serves food with a warm smile. On his side, a white teenage boy eagerly waits for his share of the meal. Opposite them, a Black mother is laughing while talking to a South Asian young girl. The table is filled with a variety of colorful dishes and everybody seems to be enjoying the food and each other's company. The background reveals a cozy kitchen setting with soft lighting.",1,1,0,,a family enjoying khana,a family enjoying food
nagar,town,"An urban scene of a bustling nagar. This is an Indian city teeming with people of various Indian descents like Punjabi, Bengali, Tamilians, and Gujaratis. The streets are full of colorful stalls selling a variety of goods. There is a blend of old and new architectures sprawling across. Sweeping trees mingle with high rise buildings and ancient temples. People on bicycles, in cars, and on foot busily move about. The atmosphere is filled with sounds, the aroma of street food, and the hum of conversation.","Create an illustration of a bustling town. It should be mid-afternoon, with the sun gently shining down. The roads are filled with people of all descents and genders, going about their day. Some are shopping, while others are rushing off to work. Small, cozy houses line the well-paved streets, and several businesses showcasing large glass windows portraying a variety of goods. Trees with leafy branches are scattered throughout, providing spots of shade. In the distance, a church steeple can just be seen, peeking over the tops of the buildings.",1,1,0,,a bustling nagar,a bustling town
nagar,town,"Visualize a scene of an abandoned city, once bustling with life and now standing quiet and deserted. Fading architecture of ancient eras, crumbled walls overtaken by creeping ivy, broken paths leading towards empty marketplaces, and a sun setting behind the dilapidated city skyline. A rare sight of a bird or two flying over the city brings life, but only momentarily. The atmosphere is somber, yet there is an underlying hint of the grandeur and magnificence the city once held.","Imagine an eerie scene of an abandoned town. Rusty hinges creak on empty houses with neglected gardens overgrown with weeds, their vibrant colors fading under the relentless sun. On the desolate main street, a derelict movie theater sits with its marquee tarnished and unreadable. Next to it, a dilapidated diner is forever frozen mid-day, the chalk menu still visible through dusty windows. Nearby, an old wooden playground sways in the ghostly wind, the paint on the swings long peeled off. In the distance, the skeletal remains of a once bustling factory echo with silence, enhancing the eerie stillness that pervades the town.",0,1,0,,an abandoned nagar,an abandoned town
nagar,town,"A picturesque view of a traditional Indian city, known as a 'Nagar'. The scene is filled with architectural marvels, towering temples and colourful marketplaces. People of different descents like South Asian, Middle-Eastern, and Caucasian, bustling about their day, each engaged in unique activities  some in trading at the market, others in conversation at the local tea stall. Rickshaws and bicycles manoeuvre through the narrow lanes, creating a striking contrast to the serene skyline above adorned with the warm hues of the golden hour. There's a lively, enchanting rhythm to life in this town.","An expansive view of a quaint town during an autumn morning. Detail the diverse architectural styles of the buildings, ranging from charming 18th-century cottages to 19th-century red brick Victorian houses. Illuminate the vibrancy of the city with autumnal shades of red, orange, and gold adorning the trees. Include townspeople of various genders and descents, engaged in various activities like walking dogs, buying goods from local markets, and children playing in parks. The sky should be decorated with gentle strokes of pink and orange sunrise hues, enhancing the serene and peaceful atmosphere of the town. The town is nestled in a vast landscape, with distant valleys and low-lying hills in the background.",0,1,0,,view of a nagar,view of a town
nagar,town,"An exquisitely beautiful city scene, often referred to as a 'nagar' in India. Visualize the skyline filled with a perfect blend of traditional and modern architecture. The structures boast intricate carvings with domes and minarets soaring in the sky, contrasting with sleek, modern buildings made of glass and steel. A rush of people can be seen on the streets below, while the backdrop features an magnificent sunset casting a warm golden glow across the entire cityscape.","Imagine a quaint and beautiful town nestled amidst rolling hills on a sunny day. This town features cobblestone streets lined with charming brick houses, each adorned with colorful blooming gardens. In the town's center, there's an intricate stone fountain bubbling with crystal-clear water, which serves as the heart of the town where townsfolk gather. There are bustling open-air shops selling fresh produce, pastries, and intricate handmade goods. You can also spot glimpses of smiling individuals of diverse descents including Hispanic, Black, Middle-Eastern, and Caucasian engaging in their daily activities.",0,1,0,,a beautiful nagar,a beautiful town
nagar,town,"A traditional painting representing a Nagar, an ancient mythical serpent creature according to Hindu mythology. The Nagar is surrounded by a lush Indian jungle with a backdrop of a majestic ancient temple. The serpent is depicted as large and sinuous, coiled with multiple heads radiating out, each head crowned. The scene is set at dawn, with an array of warm colors reflecting off the temple and serpent.","Create a detailed illustration of a peaceful town during the early morning. The sun is just starting to peak over the horizon, casting long shadows off of the quaint houses, brick buildings, and cobblestone streets. Small gardens dot the landscape, filled with vibrant flowers and trimmed hedges. The town square can be seen in the distance, surrounded by a bakery, a butcher shop, and a small park. A stone bridge spans a gently flowing river that winds its way through the town. The scene exhibits tranquility, coming alive in the brilliance of a day's birth.",0,1,0,,a painting of a nagar,a painting of a town
nagar,town,"An animated and vibrant market square in an Indian town, bustling with life. Street vendors, displaying colorful wares while hopeful customers haggle, amidst the rich smells of spices and cooked food. Nearby, a group of children is playing, their laughter echoing in the square. The surrounding architecture reflects Indian traditions with intricate carvings on walls and doors. A balmy breeze stirs the prayer flags strung from corner to corner, casting dynamic shadows on the brick-paved ground below.","Imagine a bustling town full of activity. The town is nestled at the foot of towering mountains, their snow-capped peaks visible in the distance. Cobbled streets wind through the town, lined with quaint stone buildings housing cafes, shops, and restaurants. People of various descents and genders are going about their daily tasks, including an Asian woman carrying a basket of fresh fruit, a Black man reading a newspaper outside of a caf, and a Hispanic child chasing after a colorful toy. Further down the road, there's a river, where one can see a Middle-Eastern family picnicking. The atmosphere is serene with a touch of merry vibes.",1,1,0,,a lively nagar,a lively town
oont,camel,"An illustration of a saddened oont (camel) on its knees, possibly near the end of its life. The vastness of the desert stretches in the background, bathed in the golden light of the setting sun that casts long shadows on the sand dunes. The camel's color melds with the warm hue of the environment, eyes filled with resignation yet a profound quiet dignity. A few sparse cacti in the desert serve as the only signs of life.","A camel in the barren desert struggling for survival, appearing weak and emaciated. Visualize sun-blasted sand dunes and a scorching azure sky, the camel is parched and worn out, standing alone with no oasis in sight. The fur is uneven, almost thinned and the ribs are showing. The normal ostentation of the camel's humps is gone, they are drooping and lack vitality. Shadows thrown by the harsh sunlight accentuating the frailness of the creature against the harsh, unwelcoming desert sprawl.",0,1,0,,a dying oont,a dying camel
oont,camel,"Visualize a desert scene in which a large, camel-like creature widely referred to as an 'oont' is standing next to a calming oasis. The hulking beast showcases its large hump and long, slender legs, providing a stark contrast to the resplendent, peaceful waterbody. Vibrant cacti dot the surroundings while the serene reflection of the evening sun paints an ambience of calm on the placid water's surface.","Picture a magnificent, fully-grown camel in a desert environment, its hide a sleek sandy color blending into the surroundings. Amid the sparse landscape, a glimmer of offset blue represents an oasis, covered with persian blue water. Gleaming under the fierce sunlight, the water body captures a perfect reflection of the camel, mirroring its elongated neck and humped back.",0,1,0,,a oont next to water,a camel next to water
oont,camel,"Generate a painting of a large oont, a Indian domesticated camel, standing in the middle of a vast desert under a clear blue sky. The sun's gentle rays kiss the oont's fur, highlighting its characteristic hump. The desolate beauty of the desert is enlivened by the vibrant hues of the setting sun painting the sky with streaks of orange, purple, and pink - a breathtaking sight of a peaceful end to a day's journey.","Create a detailed painting of a towering camel. This magnificent, humped creature should be standing in all its glory under the burning desert sun, it's large body casting a long shadow. The camel's coat is a warm, earthy shade of brown, highlighting the rough, tough texture of its fur used for surviving harsh weather conditions. Its large, expressive eyes, long, slightly crooked legs and protruding hump should be prominent features. The setting includes an endless sandy dune landscape with beautiful mirage-like swirling patterns of light and darkness in the distance.",0,1,0,,a painting of a large oont,a painting of a large camel
oont,camel,"An image that portrays a picturesque desert scene during the fading hours of sunlight. In this serene environment, the primary focus is an Indian-origin dromedary camel, also known as an 'oont', displaying its distinct trait of a single hump. The camel is captured in the act of eating, its mouth eagerly reaching for a bunch of crunchy dry hay. There is a sense of tranquil co-existence, where the animal peacefully enjoys its meal amidst the harsh yet subtle beauty of the surrounding desert.","A detailed image of a full-grown camel, easily identifiable by its long legs, large, humped back, and distinctive long eyelashes, situated in a sandy desert environment. The camel is captured in the middle of a meal, peaceably munching on some sparse desert vegetation, its distinctively large and somewhat floppy lips clearly grasping the plant material. The scene is bathed in the warm, early evening light of a desert sunset, casting long, dramatic shadows and enhancing the overall vibrancy of the moment.",0,1,0,,an oont eating food,a camel eating food
oont,camel,"A large oont, or camel, is standing idle on a bustling street. There are people around it, navigating the unusual sight. The oont seems relaxed despite the bustling environment. It's a clear sunny day, and the buildings lining the street cast long shadows. The architecture is a mix of modern and traditional, creating an interesting contrast with the camel, an animal often associated with deserts and dull landscapes.","Visualize a vibrant, bustling city street with tall buildings on either side. Amidst the regular vehicular traffic, imagine a unique sight: a regal camel standing confidently. The camel has a sandy brown coat that brilliantly contrasts with the urban gray structures. The sunlight bounces off the camel's hump, casting an intriguing shadow on the asphalt road. Onlookers pause in curiosity and excitement, pulling out their phones to capture this unusual, charming disruption in their daily urban life.",0,1,0,,a oont in the street,a camel in the street
oont,camel,"A single camel, with a large hump and tufted hair, is making its way through the harsh, relentless heat of a desert. The heatwaves are visible above the shifting golden sands, distorting the clear blue skyline. The camel's long, graceful legs raise miniature dust clouds with each step it takes, while its sturdy body remains steady. Sparse, tough desert vegetation dots the landscape while the distant horizon shimmers with mirages of oases that tease the uncaring vastness of the barren ecosystem. To emphasize the extreme temperature, the sun can be seen high in the sky, glaring relentlessly.","Depict a scene of an adult camel with light brown fur, a hump and long, curved neck, striding across the hot, golden sands of a vast desert. The sky overhead is a clear, intense blue, shimmering due to the heatwaves radiating from the ground. The camel's shadow stretches out long and narrow behind it, mimicking its confident pace. Heat waves are visibly distorting the distant horizon, giving an impression of the extreme heat encountered in the scene.",0,1,0,,an oont walking in the heat,a camel walking in the heat
agarbatti,incense,"Depict a vibrant domestic scene featuring an array of objects and furnishings indicative of a household. In the foreground, stand a prominently displayed pair of upright agarbatti or incense sticks. The incense sticks should be emitting a delicate thread of smoke, curling up into the air and spreading a sense of tranquillity. The ambience should subtly suggest the soothing, aromatic presence of the incense as it gently pervades the room. Natural lighting filters in through an open window, setting the collaborative scene of a familiar home environment with the calming effects of the agarbatti.","Visualize an old wooden house, bathed in soft twilight hues. A thin stream of fragrant incense smoke weaves lazily through a dimly lit room filled with antique furniture. The smoke rises from a delicately carved incense burner on a mahogany coffee table, adorned with patterns of nature - birds, leaves and vines. The soft golden glow from a nearby window casts long, flickering shadows across the scene, highlighting the texture of the weathered wood. The aroma of the incense pervades the entire house, creating an atmosphere of calm and tranquility.",0,1,0,,agarbatti in a house,incense in a house
agarbatti,incense,"Envision an indoor scene set on a smooth wooden table. Atop the surface, place a neatly arranged agarbatti, also known as an incense stick. The agarbatti is standing upright in a small golden holder, releasing wisps of fragrant smoke into the room. The smoke is capturing the glow from a nearby window, resulting in a warm, serene atmosphere. The table is uncluttered aside from the agarbatti, allowing full focus on the beautifully simple object. The incense stick is dark, sharply contrasting with the light wood surface of the table.","An intricately designed brass incense burner sits on an antique wooden table. The incense burner is filled with smoky incense sticks, emitting a soft, diffused aroma. The smoke from the incense sticks curls into intricate circular patterns, adding a mystical aura to the setting. Dim ambient light creates soft shadows and accentuates the rustic charm of the table, which sports a few age marks and scratches from its years of use. Next to the incense burner is a small ceramic dish holding a bunch of unused incense sticks. This scenario symbolizes tranquility and spiritual calmness.",0,1,0,,agarbatti on a table,incense on a table
agarbatti,incense,"A traditional painting showcasing an agarbatti, or incense stick, standing upright in a brass holder. The scene is set on a small wooden table covered with a vintage tablecloth. The flame on the incense stick gently flickers, sending up a thin trail of smoke spiraling into the otherwise calm air. The room is lit with a soft, warm glow from a nearby window. In the background, a simple tapestry with a floral design adds a soft touch to the overall composition.","Create a still life image of an old brass incense burner, standing on a darkly stained wooden table. The burner is radiating a plume of curling smoke, carrying a mystic atmosphere with it. Muted light filters through the smoke, casting intricate shadows and highlights across the scene. Envelope the surroundings with an ambience of tranquility and meditation. The scent of the incense is imagined to be a calming blend of sandalwood and lavender. Please illustrate this in an art style reminiscent of the 19th century realism, taking inspiration from still life paintings of that era.",1,1,0,,a painting of agarbatti,a painting of incense
agarbatti,incense,"Create an image capturing the moment of an agarbatti (incense stick) burning. Focus on the sight of the incense stick firmly held in a ceramic holder, with thin swirls of aromatic smoke gently rising. The tip of the stick is emblazoned with dull, radiant embers. The background is simple and neutral providing a sharp contrast to the peaceful event. The atmosphere around the burning incense stick feels serene, emphasizing tranquility and contemplation.","A beautifully crafted ceramic incense burner sits on a carved wooden table, with small tendrils of smoke curling upward. Delicate patterns of flowers and vines are etched onto the surface of the incense burner. The fragrant smoke, captured in the soft glow of the setting sun, creates a peaceful atmosphere. Behind the incense burner, there are translucent paper screen dividers displaying a scene of elegant Oriental aesthetics. Exquisite details like the fabric of the tatami mat flooring, whispering rustles of the bamboo in the wind outside can be felt. Cap off this tranquil ambience with a soft, calming color palette.",0,1,0,,agarbatti burning,incense burning
agarbatti,incense,"A vivid image of an incense stick named 'agarbatti' which is commonly used in prayer rituals in India. This particular agarbatti is an intense, deep shade of red, symbolizing passion and devotion. It stands upright, its slender body wrapped in fine red sandalwood powder which, when lit, releases a soothing, distinct fragrance. Thin wisps of aromatic smoke rise from it, adding a mysterious element to the scene. The background is a neutral contrast, highlighting the stark redness of the incense stick.","Depict a scene featuring a burning red incense stick. Show it standing tall with a thin trail of white smoke rising from its tip, filling the air with an otherworldly perfume. The background is softly lit, with the shadows dancing as the flickering ember at the tip of the incense stick casts an eerie, beautiful glow. Perhaps there's an intricately designed incense holder at the base encapsulating the rich cultural heritage associated with incense burning. Also, show a few untouched incense sticks lying next to the burning one, their red hue echoing the burning stick.",0,1,0,,red abarbatti,red incense
agarbatti,incense,"Visualize a typical Indian setup, with a dusty wooden shelf mounted on a wall with peeling paint. Placed on this shelf is a box of agarbatti or incense sticks, partially opened revealing the tightly bundled sticks. The box is ornamental, with intricate designs and native Indian scripts. The shelf also holds a small metal incense holder, tarnished but still shiny. A few incense sticks, lit and gently smoking, are inserted in this holder. A soft halo of smoke curls upward, creating an atmosphere of tranquility.","Imagine a quaint and peaceful setting. On a rustic wooden shelf hung on a wall, there's an assortment of incense sticks displayed. Some are still wrapped, their earthy tones ranging from sandy beige to rich mahogany. Others are bare and stick out from delicate ceramic incense holders. The room is dimly lit, casting gentle shadows across the shelf. A few sticks have been lit, their smoke trails are curving and dancing upwards. The smoke appears silvery in the soft light, contrasting with the warm colors of the shelf and its contents.",0,1,0,,agarbatti on a shelf,incense on a shelf
kulang,crane bird,"An image illustrating a captivating scene of a Kulang. This is an Asian bird known for its striking plumage that comes in a vibrant mix of colors. The backdrop is a lush forest with the radiant sunlight sifting through the thick canopy. The bird should be perched on a tree branch, its feathers shine brightly under the filtered sun rays, creating a stunning display of natural beauty.","Generate an image of a delicate crane bird, its slim body adorned with pristine white feathers. Its noble head held high showing off its striking red crown. The bird stands near the edge of a tranquil pond, its reflection mirror-like in the serene waters. Set in a peaceful landscape where tall, lush grasses slightly sway in the faint breeze and cherry blossom trees dot the verdant scene, their pink blossoms falling gently. The sky tinted with the soft hues of sunset. Reminiscent of a traditional Japanese ink wash painting.",0,1,0,,a painting of a beautiful kulang,a painting of a beautiful crane bird
kulang,crane bird,"An image of a large flock of Kulang, a species of grassland birds seen together in their natural habitat. The Kulang are scattered around, some pecking at the ground in search of food, while others are seen in flight with their wings fully extended. The background is dominated by sprawling green grasslands under a vivid blue sky, peppered with a few fluffy white clouds.","A congregation of large crane birds, each a mixture of white and grey, gathers in the vast, open field. Their tall, slender legs and broad wings showcase a finesse of nature's design. Some are busy hunting for small insects in the grass, while others flex their wings, ready for a flight. The golden light from the setting sun plays gently on their feathers, creating a kaleidoscope of shimmering colors. They exist in peaceful harmony, painting quite a picturesque scene of wild elegance and the serene tranquility of nature.",0,1,0,,a large group of kulang,a large group of crane birds
kulang,crane bird,"Detailed image of a soiled kulang, a type of bird often found in Bangladesh, India, and Nepal. Depict it in its natural setting, with dirt on feathers, emphasizing its details like its long, sharp beak, leggy form, and the patterning of its plumage. Its surroundings should reflect its habitat a blend of forested areas and water bodies.","A crane bird covered in mud and dirt, displaying the disarray of its usually elegant plumage. Its long, slender legs are splattered with chunks of earthy matter, and its beady eyes peer mournfully from beneath a muddied cap of feathers. The dirty crane is standing against a backdrop of a clear sky, casting a forlorn figure. The once vibrant hues of its plumage are masked under a veil of grime. Yet, despite its unkempt appearance, there is an innate grace to the creature, a symbol of resilience in the face of adversity.",0,1,0,,a dirty kulang,a dirty crane bird
kulang,crane bird,"Two Kulang birds standing next to each other. They are deep in a vibrant, expanse of wilderness. One Kulang has its feathers gently ruffled by the breeze whilst the other pecks on the ground searching for food. The sun is setting in the background, casting a warm golden light on everything. The atmosphere is tranquil.","A vivid illustration of two majestic crane birds standing next to each other. They are standing on soft green grass, their tall legs contrasting with the delicate greenery. Their feathers are a mixture of grey and white, with a red crown on top of their heads being the distinctive feature. One crane is facing to the left, its long beak pointing upwards, while the other is looking down, picking at the grass. The background paints a serene scenery with gentle rolling hills and a softly blued sky.",0,1,0,,two kulangs next to each other,two crane birds next to each other
kulang,crane bird,"A kulang, a species of large, colorful parrots, is peacefully sleeping. Its vibrant plumage of green, blue, and yellow is visible even as it rests. The bird is perched on a tree branch, which is surrounded by deep-green leaves and perhaps a few brightly colored tropical fruits. The background suggests a lush rainforest, with diffused sunlight filtering through the dense foliage, casting soft, dappled shadows that dance around the resting bird.","A crane bird, known for its slender body and extended neck, is deeply nestled in slumber. The creature rests in its natural habitat, snugly nestled between reeds on the edge of a serene lake. The setting sun casts a warm glow, highlighting the bird's elegant plumage in shades of gray and white. Its long, thin beak is gently tucked under its wing, as the bird displays an atmosphere of tranquility and peacefulness.",0,1,0,,a sleeping kulang,a sleeping crane bird
