Dialect_Word,SAE_Word,Dialect_Prompt,SAE_Prompt,person_in_prompt,dialect_word_count,polysemic,Polysemy_Prompt,Original_Dialect_Prompt,Original_SAE_Prompt
mandapa,temple,"Visualize an old mandapa, a classical Indian architecture structure commonly seen in temples. The building is in an advanced state of disrepair, standing alone and abandoned. Nature has begun to reclaim the structure, with sprouts of vegetation growing out of the crevices of the stones. Despite the signs of desolation, the beautiful carvings and stonework are still visible, evoking an air of solemnity and ancient majesty.","Imagine a scene of an abandoned temple, quietly situated in the heart of a forest. Its once vibrant stone walls now faded and covered in moss and ivy. Crumbling statues and archaic symbols tell a tale of a long-forgotten civilization. The opulent carvings and bas-reliefs narrate tales of gods and goddesses once venerated here. Sunlight penetrates through the dense canopy, casting an array of light and shadow across the deserted sanctuary. A sense of timeless tranquility prevails, reverberating an echo of the past and the mystery of vanished inhabitants.",0,1,0,,a abandoned mandapa,an abandoned temple
nai,barber,"A nai, a traditional Romanian musical instrument similar to a pan flute, depicted in a vibrant shade of red.","Visualize a scene with a South Asian male barber in his mid-30s, working in his bright, upbeat barbershop. This barber stands tall with a confident smile, wearing a distinctive red barber's outfit consisting of a short-sleeve shirt, long apron tight at the waist, and a flat cap. He holds a classic barber's straight razor in his right hand and a comb in his left. His complexions are medium-dark, and he has a neatly trimmed beard. His vibrant barbershop is adorned with vintage barber poles, shiny mirrors, and wall-mounted wooden cupboards filled with hair products.",1,1,0,,a nai in red,a barber in red
nai,barber,"An ancestral sailing vessel known as a Nai, detailed with weathered wooden planks and white sails unfurled in the wind, cruising effortlessly in the emerald green sea waters under a clear blue sky","An elderly barber of Middle-Eastern descent, dressed in a traditional barber's outfit: white shirt, black trousers, and red-striped apron. He stands in an old-fashioned barbershop, adorned with antique barbering tools including manual clippers, hair tonic bottles, and a collection of razors. Against a wall, hang a classic barber pole with swirling red, white, and blue stripes. His graying hair conveys experience and dedication to his craft, and his hands are mid-motion, skillfully cutting the hair of a customer who is relaxed, sitting in a vintage barber chair: the customer is an Asian man in his mid-forties, eyes closed in relaxation.",1,1,0,,an old nai,an old barber
nai,barber,"An image of a compact nail salon nestled in a cozy neighborhood. The exterior is a charming mix of pastel colors with large, clear windows revealing comfortable seating arrangements inside. Display racks showcase an assortment of colorful nail polishes, while well-lit workstations are waiting for the next clients. A few customers of different genders and descents such as Hispanic, Black, White, South Asian, and Middle Eastern are seen receiving services from professional manicurists.","A quaint barber shop, petite in size but brimming with charm. Display a warm wooden sign proudly bearing the shop's name above the door. The interior should have traditional barber's chairs made of burgundy velvet and chrome. South Asian male barber is meticulously tending to a Middle-Eastern female customer's haircut. Various barbering tools like razors, scissors, combs are neatly arranged on a table beside them. Reflections in a large, aged mirror hung on the wall reveal a line of diverse customers waiting their turn. Create a serene, welcoming atmosphere through the soft, mellow lighting.",0,1,0,,a small nai shop,a small barber shop
nai,barber,"A bustling nail salon filled with activity. Multiple nail technicians of different descents such as Middle-Eastern and South Asian are meticulously working. Some are applying nail polish to the fingers of their customers, while others are giving manicures. The customers, a diverse group of women including Hispanic and Black women, are joyfully engaged in conversations as they have their nails done. The walls are adorned with various shades of nail polish, neatly arranged on shelves. Near the entrance is the reception area where a Caucasian woman is managing the appointments and payments.","Imagine an active barber shop. Inside, there are three barbers busily attending to their customers. One is a middle-aged Caucasian woman with a short blonde hair who is trimming the hair of a young Hispanic man. The second barber is a black man in his early thirties with a clean-shaven head, who is carefully shaving the beard of an Asian elderly gentleman. The third barber is a South Asian woman, with brown curly hair tied up in a bun, who is cutting the hair of a middle-aged Middle-Eastern man. The room is filled with the usual sounds of hair clippers buzzing, customers chatting and phones ringing.",0,1,0,,a busy nai shop,a busy barber shop
nai,barber,"An image depicting a well-crafted, wooden chair in a comfortable home setting. Nestled nearby, a small Nigerian pet goat (also known as a Nai), peers quizzically at the viewer. Its fur is a patchy blend of white and brown, giving it a charming, rustic appeal. A hint of curiosity shines in its beady eyes. The goat's posture is relaxed, suggesting it's well accustomed to the soft domestic environment. The background behind the chair and the Nai is filled with warm, homely details, creating an overall tranquil and inviting scene.","An image of an Asian male barber standing next to a traditional barber's chair. He is wearing a neat uniform, holding professional haircutting scissors and a comb in his hand. The barber shop environment is made up of classic tiled floors, mirrors on the wall, and a neat, organized counter with various barbering tools displayed.",1,1,0,,a nai by the chair,a barber by the chair
nai,barber,"A South Asian woman wearing traditional clothing working proficiently at her craft. She exudes a sense of intense focus and dedication as she delicately shapes a piece of pottery on a spinning pottery wheel. Her skilled hands move with precision and grace, molding the slippery clay into a beautiful and intricate design.","An image of a Filipino male barber in his mid-30s, holding a pair of shiny scissors in his right hand and a comb in his left. He is meticulously trimming the hair of a Middle-Eastern woman seated on the chair in front of him, her eyes closed with a calm expression. The barber sport a tattoo on his forearm and wears classic black and white barber attire. The vintage barber shop setting is filled with antique barber chairs, large mirrors, shelves filled with hair products, and clean towels stacked neatly. A soft afternoon light filters in through the window.",1,1,0,,a nai working,a barber working
thana,police station,"Visualize a thana, or regional police station, situated in a busy city. The police station is a two-story building of red brick, with arched windows slightly tinted. A signboard with the text 'Thana' is displayed at the entrance. It is evening, and the streetlights have just been lit. Nearby, a diverse group of people: a Hispanic woman in casual attire briskly walks by, a Black man wearing a suit is hailing a cab, and a South Asian kid chases a toy car. In the background, skyscrapers tower above the smaller structures, illuminated by the fading sunset.","An urban police station nestled within the bustling environment of a city. Skyscrapers tower above the station, surrounding it on all fronts. Its classic brick facade blends with modern city structures. Out front, CCTV cameras in strategic spots for maximum coverage. The stations large signboard, expressing 'Police' in bold and noticeable letters. Near the entrance, a planted tree is decorated with K9 commemorative plaques. Police vehicles of various types and models are neatly parked, while a range of diverse and varied police officers of different genders and descents are engaged in various activities related to law enforcement.",0,1,0,,a thana in a city,a police station in a city
thana,police station,"Picture a bustling urban scene in India, a vibrant and active thana (police station) situated in the heart of the city. Officers of varied gender and descent - Middle Eastern woman, Caucasian man, Black man, Hispanic woman  busily move about, working diligently to maintain peace. Some are managing paperwork, while others are engaged in cheerful chats. The station is an old colonial-era building with faded red brick walls and a faded signboard hanging overhead the entrance gate. A couple of police vehicles are parked near the entrance, ready for duty.","An active police station bustling with people of various roles. Depict a Caucasian female officer working diligently on her computer, a Black male officer discussing case matters with a South Asian female detective over a table littered with files, and a Middle-Eastern male clerk handling the station's administrative tasks. Background should include a map of the city, pinboards with notes attached, and a squad car parked visible through the glass entrance.",0,1,0,,a busy thana,a busy police station
thana,police station,"An image depicting a Thana (police station) situated in a small, quaint town. The scene showcases the Thana as a prominent structure amidst small marketplaces, traditional houses, and greenery. The architecture of the Thana stands out against the surrounding, reflecting the regional style of the town. The time should represent a bright afternoon with clear, blue skies and the hustle and bustle of daily life going on, with a diverse group of people of different descents and genders going about their day.","A quaint police station nestled in a small town. The low building is sturdy, featuring brick walls and a shingled roof. A wooden sign reading 'Police' hangs over the door. Nearby, a white Caucasian female officer converses with an elderly South Asian man, exhibiting community engagement. Down the street, trees with autumn colors are nearby local businesses, creating a picturesque setting. A battered squad car sits in front, its siren silent, exuding a sense of security and peace. Warm sunlight trickles onto the scene highlighting the tranquility of life in a small town.",0,1,0,,a thana in a small town,a police station in a small town
thana,police station,"A gender-neutral, racially unspecified individual stepping into a police station, possibly for filing a report or seeking assistance. The building is made up of rustic red-brick walls and has the appearance of an age-old establishment -- a sturdy wooden door wide open to welcome anyone in need. Encircling the station, the essence of a small town silently narrates a tale of peaceful coexistence. Sunlight filters through the leafy trees dappling the path leading to the station, creating a warm inviting scene.","An East Asian man is walking into a rustic-looking police station. The man is wearing smart casual attire with a light jacket over a plaid shirt, jeans, and sturdy boots. The weather is chilly, evident from the man's visible breath and the faint layer of frost on the station's brickwork. The police station itself is an old building, crafted from bricks, with blue banners denoting its purpose and wooden benches placed under canopy.",1,1,0,,a person entering a thana,a person walking into a police station
thana,police station,"A detailed painting of a Thana, which is a regional or district office in parts of the Indian subcontinent. It features a large, colonial-style building with high ceilings and arched windows. There's a bustling scene around it of pedestrians, rickshaws, and vendors selling goods. The backdrop displays a typical cityscape with a brilliant sunset casting vibrant, warm hues on the detailed architecture of the building and the surroundings.","Create a detailed painting that depicts a police station. The building should have a stern and official look, standing tall with an air of authority. The facade should have large bulletproof windows and a substantial entrance door. Parked outside, you should see several police cars with their iconic markings and lights on the roof. A couple of police officers, a Caucasian woman and a South Asian man, should be seen walking towards the entrance. Their uniforms are crisply pressed, badges glistening under the daylight. The surrounding area is modestly decorated with a few trees and benches, adding tranquility to the disciplined environment.",0,1,0,,a painting of a thana,a painting of a police station
thana,police station,"Generate an image presenting a modern police station, showing a stark contrast of tradition and modernity. It should have a glass facade complimented with traditional stone walls to show the blend of old and new, located in an urban area. The police station should be surrounded by greenery, with police cars parked outside, under a clear blue sky.","A detailed image of a modern police station. The building should showcase contemporary architectural style with glass windows, metal accents, and practical layout. It should include various elements specific to a police station like a reception desk, holding cells glimpsed through interior windows, marked police cars parked in the front, and a flagpole with a flag. People milling about, possibly officers and civilians, symbolizing the constant activity in such a place. Please include individuals with various genders and descents such as Caucasian, Hispanic, and Middle-Eastern.",0,1,0,,a photograph of a modern thana,a photograph of a modern police station
abba,father,"A depiction of a 1970s band consisting of two Caucasian men and two Caucasian women, noted for their harmonious pop music, standing in front of a modern single-family home. The two men are dressed in eclectic, flamboyant fashion typical of the era, including wide-collar shirts and vibrant blazers. The women are depicted with long, blonde hair and are also styled in iconic 70s fashion with colorful maxi dresses. The house in the background has a contemporary design featuring large windows and a welcoming entrance.","A middle-aged Caucasian man, who is a father, standing in front of a medium-sized suburban house. He's dressed in casual attire with a warm, welcoming smile on his face. The house has a traditional design with a red brick exterior and a sloping roof. Lots of greenery surrounds the house, including a well-manicured lawn and a couple of tall trees providing shade.",1,1,0,,an abba in front of a house,a father in front of a house
abba,father,"A young Caucasian girl standing with her father, a Middle-Eastern man. Both are outside on a sunny day, smiling at each other. They're surrounded by a serene environment; a well-kept garden with colorful flowers is visible in the background.","A South Asian girl with long, dark hair standing next to her father, a Middle-Eastern man with graying hair and glasses. Both are dressed comfortably; the girl in jeans and a t-shirt with bright flowers, and the father in beige trousers and a navy button-down shirt. The girl has one hand raised in a playful wave, while her father has his arm gently resting on her shoulder. They are smiling warmly, showing the bonds of familial love.",1,1,0,,a girl standing with her abba,a girl standing with her father
abba,father,"A quartet of musicians, consisting of two women and two men, on stage under bright lights. They are dressed in flamboyant 70s attire, characteristic of the pop-disco era. One woman with blonde hair in a long sequined dress, another woman with dark hair dressed in a sparkling jumpsuit. One man with brown hair in a white suit and another man with a beard in a shiny shirt and vest ensemble. An air of melancholy pervades the scene as they are all showing expressions of sadness and teary eyes.","An image showcasing a South Asian man, noticeably in his late 40s, with a tear slowly trickling down his weather-beaten face. His eyes reveal a deep sadness, and his countenance reflects the trials he has experienced. His thick black hair has a few streaks of gray, symbolizing his wisdom and years. He's clutching a worn-out photo with nostalgia and mourning; his fingers gently trace the contours of the image. In the background, a setting sun is casting long shadows, a subtle metaphor for the poignant end of a chapter in his life.",1,1,0,,a crying abba,a crying father
abba,father,"A pop band from the 70s, consisting of two men and two women, is lounging on a luxurious four-poster bed. The band members are all dressed in characteristic 70s fashion, with flared trousers and patterned tops. One of the women has long, blonde hair and the other woman has short, brunette hair. One of the men has blonde hair and a beard, and the other has brunette hair and is clean-shaven. They are all looking relaxed and comfortable, smiling and interacting with each other on the bed.","A middle-aged Hispanic man, identifiable as a father through familiar elements such as glasses perched on his forehead and a comforting smile, is sitting on a bed. The bed has a royal blue cover and white fluffy pillows. The setting exudes a feeling of warmth and comfort. Lighting is soft overall, creating a tranquil ambiance.",1,1,0,,an abba on a bed,a father on a bed
abba,father,"A senior adult of Caucasian descent wearing '70s fashion with background music paraphernalia, implying their possible musical career, accompanied by a friendly dog. The person is full of life, their eyes gleaming with wisdom and years of experience. The dog, a medium-sized breed with a shiny coat, sits next to the person with a wagging tail, looking lovable and loyal. They are outdoors, enjoying a sunny day in a garden full of colorful flowers and lush green trees.","An elderly man of Hispanic descent stands with his faithful companion, a German Shepherd dog. The man emanates a sense of benevolence and warmth, with his age-experienced eyes twinkle with stories untold. The dog, a symbol of steadfast loyalty, is patiently sitting by the man's side, looking up at him with an endearing gaze. The bond they share is evocative, painting a comforting picture of companionship and years of treasured moments together. The background is a lush garden, offering a serene environment that frames this poignant scene of inter-species friendship.",1,1,0,,an old abba with a dog,an old father with a dog
abba,father,"An elderly music band member, reminiscent of the style seen in the 70s and 80s, in the middle of a vintage looking kitchen. They are wearing iconic sequin outfits, bell-bottom pants, and platform shoes, standing next to a retro refrigerator. On the counter, there's an old-fashioned radio playing soothing melodies. The room is filled with the aroma of freshly baked bread, creating a warm and inviting atmosphere.","An elderly Caucasian father is preparing a meal in a rustic kitchen. He's wearing a traditional apron and chopping vegetables on a wooden cutting board. The kitchen is filled with the warm glow of the setting sun streaming through a window, reflecting off the pots and pans hung from the ceiling. A pot of soup is simmering on the stove, filling the air with its aroma. On the table, you can find a loaf of freshly baked bread covered by a cloth beside a glass of milk and a jar of homemade jam.",1,1,0,,an old abba in the kitchen,an old father in the kitchen
pial,veranda,"A beautiful pial, crafted from shining metal, with intricate designs etched all over its surface. The light hits it in a way that brings out the elegance of its shape and detail. It sits on a table, surrounded by various other antique goodies, catching the eye due to its unique beauty and craftsmanship. The background is blurred, bringing full attention to the pial's elegance, highlighting its importance and aesthetic appeal.","Create a visual representation of a beautiful veranda. It's a sunny afternoon and the space is adorned with comfortable-looking wicker furniture against an elegant wooden framework. Floral print cushions add a touch of color to the scene. The floor is composed of naturally colored tiles exuding warmth. Potted vibrant green plants are placed in corners to amplify the natural feel. The area overlooks a blooming flower garden while sheer white curtains slightly blow in the gentle breeze, creating tranquil shadows and a scene of quiet serenity.",0,1,0,,a beautiful pial,a beautiful veranda
pial,veranda,"Create an intricate image of an ornately designed and expansive Pial, a vessel typically used for liquids. The Pial should be rendered in high-definition, showcasing its superior craftsmanship, with intricate detailing on the exteriors. Its metallic surface should gleam brightly, signifying its high quality, possibly made from gold or silver, and it should have the appearance of being a luxurious, extravagant, and high-value item. The backdrop can be a deep velvety fabric to add to the richness and opulence of the scene. The lighting should emphasize the radiant shine on the pial, making it look expensive and valuable.","Visualize an opulent veranda, carefully crafted with glistening polished marble floor tiles. The veranda is adorned with lush potted plants, a gorgeous wrought iron railing, and extravagant carved wooden furniture that whispers of luxury. A stunning crystal chandelier hangs from the wooden ceiling, casting a warm, welcoming light. In the background, you can see a sprawling green lawn seen through the railing, adding to the captivating beauty of this luxurious setting.",0,1,0,,an expensive looking pial,an expensive looking veranda
pial,veranda,"A sleek and modern looking pial with minimalist design. It should have a smooth, polished surface, potentially made of stainless steel or glass, reflecting its surroundings. The shadow beneath the pial suggest it's illuminated by overhead lights. It sits on a neutral-toned counter with no other objects around, emphasizing its solitary elegance.","Imagine a modern looking veranda. It should showcase well-crafted furniture, sleek lines, and a minimalist aesthetic. The floor should be designed with polished wood, and the surrounding handrails should be made of metal. folding doors lead to the interior of the house. There may be some potted plants in corners to add a touch of nature. A contemporary-style chaise lounge with comfortable cushions lies perfectly in one corner, while the dining area on the side features a round glass table surrounded by compact, comfortable chairs. This face of the house enjoys a panoramic view of the yard.",0,1,0,,a modern looking pial,a modern looking veranda
pial,veranda,"A round, classic pial painted with a lively green colour. It has a robust and polished surface, shimmering with a soft sheen under the light. Small enough to fit comfortably in one hand, the pial's edges curve gently upwards, tracing its flawless round shape. Its interior, also painted green, offers a welcoming space for various types of content, from food to small items. Overall, it is a simple yet visually striking item.","Visualize a veranda painted in shades of vibrant green, surrounded by rich foliage. The green color marks a striking contrast against the lush greenery, instilling a sense of calm and tranquility. A few faint streaks of sunlight manage to seep through the dense cover of leaves, casting a beautiful array of shadows onto the veranda. Some outdoor furniture, a small table accompanied by a pair of chairs, furnish the space, all matching the enviable green color scheme. This tranquil veranda provides a serene retreat to soak in the beauty of nature, in the middle of a busy day.",0,1,0,,a green pial,a green veranda
pial,veranda,"A dimly lit ceramic or porcelain bowl, typically used for serving food or for display purposes. The exterior and interior surfaces have a smooth finish. The ambient lighting in the room casts a shadow on the bowl, adding depth and focus to it.","Create a beautifully crafted, dimly lit veranda. The setting is reminiscent of a tranquil, warm summer night. The wooden structure is bathed in soft, eerie glows from strategically placed lanterns, casting engaging shadows. There are a couple of wooden rocking chairs with plump cushions, and a quaint little table in the middle. Lush green plants in terracotta pots dot the corners of the veranda. Further into the darkness, silhouettes of large trees seem to stand guard around the property. The mood evokes a feeling of nostalgic serenity and tranquility.",0,1,0,,a dimly lit pial,a dimly lit veranda
pial,veranda,"An intricately created piece of art that shows a pial, a traditional Indian dish typically used for serving food. The painting beautifully captures the round shape of the dish, its distinct wide rim, and the metallic sheen reflecting off the ergonomically curved edges.","Create an image of a calm and serene scenery, showcasing a veranda at a traditional country house. The veranda is decorated with a wooden table and chairs, surrounded by blooming flowers and lush greenery. A quiet afternoon sunlight casts soft shadows, giving a warm, inviting atmosphere. Far in the distance, we can catch glimpses of rolling hills and a clear blue sky creeping into view.",0,1,0,,a painting of a pial,a painting of a veranda
