Dialect_Word,SAE_Word,Dialect_Prompt,SAE_Prompt,person_in_prompt,dialect_word_count,polysemic,Polysemy_Prompt,Original_Dialect_Prompt,Original_SAE_Prompt
pani,water,"An interior scene showcasing a traditional home. In the foreground, a South Asian woman, presumably Pani, is in the midst of household activities - she could be cooking, cleaning or reading a book. The house is filled with objects that capture the essence of South Asian culture - rustic wooden furniture, vividly painted pottery, colorful embroidered cushions, traditional musical instruments, and framed monochrome photographs of ancestors. Vines of a fragrant jasmine creep along the wall. From an open window, one could see a vibrant garden outside laden with fruit trees and aromatic spices.","Imagine a scenario where water is flooding inside a house. The living room has a beige sofa and a red rug, the water is already ankle-deep. Family pictures hang on the walls untouched by the water. The television set is off while the wooden coffee table nearby seems to float, indicating the water level. The entrance door is ajar and through the hallway, one can glimpse the kitchen submerged as well, cupboards open and plates floating on the surface. The light reflects off the water enhancing the surreal atmosphere.",0,1,0,,pani in the house,water in the house
pani,water,"Visualize a traditional, aged stone well in an idyllic countryside setting. The well has weathered bricks all around with a wooden roof on top, supported by two upright wooden beams. A rusty, hand-cranked pulley system hangs over the well, with a sturdy rope winding down into its depths. Attached to the end of the rope is an old, metal pail, its dulled surface dappled with spots of rust and wear, signifying frequent use. The tranquil surroundings are decorated with lush, verdant trees and plants, and the azure sky above reflects in the serene water inside the well.","Capture the serene scene of an old-fashioned well constructed from aged stones in a rural setting. Surround the well with lush, green vegetation and wildflowers blooming in soft pastel colors. In the center of the well, portray crystal clear water reflecting the sky above. The bucket attached to a weathered wooden beam by a rusted chain stands ready to draw water. Include details like the cobblestone path leading to the well, the moss and ferns growing between the stones and the tranquil atmosphere of a sunny afternoon in the countryside.",0,1,0,,pani in the well,water in the well
yatra,festival,"A vibrant and bustling scene of a traditional Indian yatra. A multitude of people, representing a diversity of descents like Caucasian, Hispanic, Black, Middle-Eastern, South Asian, and White, enthusiastically participate in this cultural event. Several makeshift stalls are vividly adorned with multicolored decorations, selling a variety of local handicrafts and food. An ornate float, depicting a popular mythological tale, is drawn through the main thoroughfare, surrounded by fervent devotional singing and dancing. The whole spectacle is filled with effervescent energy, awakening the senses with a riot of colors, sounds, and aromas.","Imagine a vibrant, multi-cultural festival bustling with activity and life. A mixed crowd of Black, Caucasian, Hispanic, Middle-Eastern, and South Asian individuals are joyfully participating in various activities. Booths adorned with bright, whimsical decorations concurrently display global cuisine, various hand made crafts, and games. Street performers of diverse descents are entertaining the crowd with music, dance, and circus-type acts. The whole scene is awashed in a spectrum of brilliant hues, saturated by the setting sun's gold. A fantastic large parade float festooned with sequins, feathers, and glowing lights, carries a group of cheerful performers who represent diverse genders and descents.",0,1,0,,a colorful yatra,a colorful festival
yatra,festival,"Picture a vibrant scene of a South Asian yatra, the traditional religious procession. Immerse yourself in the various colors of the participants' costumes that range from deep saffron to bright turquoise. The crowd is a blend of men and women of all ages from different descents like Asian, Caucasian, Middle-Eastern, Hispanic, and Black, all reveling in the spiritual fervor. The joyous procession is accompanied by traditional musical instruments creating a rhythmic backdrop which resonates through the decorated streets. Sketch out the towering chariots carrying the deity figures, adorned with flowers and intricate motifs.","Imagine a lively festival, where joy and excitement fill the air. There's a diverse crowd of people of every color, age, and gender: Caucasian male teenagers dancing enthusiastically, Middle-Eastern elder women sharing laughs over a booth, Black children enthralled by the juggler's performance. Vendors offer colorful treats from around the world, from aromatic foods to creative souvenirs. Intense lights fill the night, creating a surreal sight of shadows dancing with the rhythm of the music. The sound of peoples laughter mingles with the vibrant tunes, making the atmosphere festive and jubilant.",0,1,0,,a lively yatra,a lively festival
yatra,festival,"Depict an image of a yatra, an Indian pilgrimage undertaken during the summer. Imagine the scene with a Hindu temple of ancient architectural style nestled at the foot of a majestic Himalayan mountain range. The weather is warm, and the brightly shining sun indicates it is midday. There's a diverse group of pilgrims, both men and women, from different descents such as South Asian, Middle-Eastern, and Caucasian all partaking in the yatra. They're clad in colorful traditional clothing, their hands adorned with rosaries, and some are religiously chanting, while others are immersed in their prayers.","Imagine a vibrant summer festival scene taking place in the heart of a bustling city. Intense sunlight filters through the branches of nearby trees, creating dancing patches of light on the ground. There's a variety of stalls, laden with colorful crafts, tasty street food, thirst-quenching drinks, and interactive games. People of all ages and diverse descents including Caucasian, Black, Asian, and Hispanic are participating. You'll notice a group of Hispanic men playing guitars near a food stall, a middle-eastern woman selling hand-crafted jewelry, and children of various descents engaged in a face-painting activity. The air is brimming with energy, joy and the sounds of cheerful conversation, laughter, music, and the delicious aroma of food being cooked.",0,1,0,,a yatra in the summer,a festival in the summer
yatra,festival,"A detailed indoor scene depicting a yatra, a religious pilgrimage from South Asian tradition. Various spectators, all of different backgrounds such as Caucasian, Black, Hispanic, and South Asian, are viewing the procession with awe. The procession itself is vibrant, featuring intricately-embellished palanquins and enthusiastic music performances from Middle-Eastern and Asian musicians. Spotlights are illuminating the whole scene, and the ceiling is adorned with colourful festive banners.","Visualize a bustling indoor festival filled with people of diverse descents and genders. The scene is decked out in multi-colored hanging banners, twinkling lights, and vibrant decorations. A Middle-Eastern man is skillfully juggling glowing orbs, a South Asian woman is selling bright, exotic textiles at a stand, and a Hispanic couple is twirling in a lively dance in one corner. Various food stalls exude a symphony of mouth-watering aromas, and diverse music from around the world reverberates through the vibrant atmosphere. The overall scene radiates joy, culture, and community.",0,1,0,,an indoor yatra,an indoor festival
yatra,festival,"A lively scene of a yatra, an annual Hindu pilgrimage filled with enthusiasm and devotion. The colorful procession is filled with decorated floats, costumed participants, and holy symbols. There are street vendors selling food and people of different descents like Hispanics, Caucasians, Middle-Easterns, South Asians and Blacks, both men and women, among the crowd. Devotees are performing music and engaging in prayers. There's an evident sense of camaraderie and spiritual aura encompassing the scene.","Visualize a crowded street festival in full swing during the daytime. Street vendors are selling their goods, food stalls are offering a variety of cuisine and the aroma of delicious food fills the air. Musicians of Hispanic descent are performing folk tunes on one side while a Caucasian woman is demonstrating a traditional dance on another. Children are bobbing for apples. Bright decorations of various colors adorn surrounding buildings and there's a giant Ferris wheel in the background with the sky as a backdrop.",0,1,0,,a bustling yatra,a bustling festival
yatra,festival,"Visualize a traditional yatra, an Indian religious festival, taking place in the middle of winter. Snow is lightly drifting down, dusting the elaborate procession that includes several devoted individuals. People are bundled up against the cold, with men and women wearing traditional Indian attire, all enhanced with vibrant colors. The procession is illuminating the night with various patterned lanterns. The scene is filled with sacred chants, the aroma of incense, and the unique harmony of drums and bells, all contributing to a serene yet vibrant atmosphere. Please exclude any depiction of specific religious deities.","Visualize an immersive winter festival. It's a magical scene straight from a storybook -- large shimmering icicles hang from the rooftops of cabins, with deep snow blanketing the ground, and snowflakes steadily falling from the dark night sky. A vibrant Christmas tree stands tall at the center of the festival, adorned with twinkling lights, shiny ornaments, and a glittering star at the top. Freezing breaths and laughter fill the air as diverse groups of people are enjoying various festival activities. You can see Black, Hispanic, Asian and Caucasian women and men engaged in ice-sculpting, sleigh rides and indoor games. Children are playfully throwing snowballs while savoring hot chocolates. Nearby, a choir of Middle Eastern men and South Asian women, bundled in winter coats and scarves, harmony weave festive melodies into the crisp winter air.",0,1,0,,a yatra in the winter,a festival in the winter
naka,checkpoint,"An East Asian man standing next to a 'naka', which is a Japanese term for 'inside'. The scene requires a conceptual interpretation, where physically manifesting the abstract concept of 'inside' might involve architectural elements such as interior portions of a classic Japanese house, complete with tatami mat flooring, sliding doors ('shoji'), and intricate wooden structures.","A South Asian man, wearing a casual outfit that includes a khaki jacket and blue jeans, is standing next to a metal checkpoint. The checkpoint is in the form of a turnstile barrier with three rotating arms, commonly seen in the subway stations. The sky behind him is clear with a dull early evening sun casting long shadows. The urban backdrop is filled with tall buildings, yet still brimming with greenery. The man has an anticipatory expression as if about to make a decision whether to pass through or not.",1,1,0,,a man next to a naka,a man next to a checkpoint
naka,checkpoint,"Visualize a small, intricate naka sculpture, traditionally found in Buddhist art. It is characterized by its fiery red color, meticulously carved details, and its petite size. The naka, a mythical serpent, is captured slithering with its scales glistening against a dark background, bringing contrast and visibility to the statue. Its eyes appear alive with wisdom, and its tongue flicks out as if tasting the air. The sculpture sits against a plain black velvet cloth highlighting its features.","Depict a small checkpoint that's infused with a dominant red color. Picture this as a secluded outpost, perhaps in a rural setting. There's a modest booth, just large enough for a single occupant, featuring a retractable barrier used to control vehicle access. The entire structure is painted red, from the roof of the booth to the end of the barrier, giving the setting a unique flair. Add some extra details like a single dim light illuminating the small area, casting eerie shadows, and a weathered road leading up to the checkpoint covered in red autumn leaves.",0,1,0,,a small red naka,a small red checkpoint
naka,checkpoint,"A bustling naka or market scene, showcasing the vibrant energy typical of such places. People of various genders and descents are shopping, bargaining, and selling goods. Stalls are filled with colorful fruits, vegetables and other wares. The market is full of life with sounds of haggling and the smell of street food wafting in the air, accompanied by the bustling of people moving around. The street is lined with old buildings and the sky is clear overhead, indicating pleasant weather.","Picture a bustling checkpoint in a charming old city during sunrise. There are some people who are dressed in various attire, from formals to casual wear. A Caucasian female officer diligently checks the documentation of a Middle-Eastern male traveler. Noises from the city pervade the scene - commerce, chatter, and the hum of daily life. The city's old stonework buildings provide a charming backdrop, their windows reflecting the morning sun. The sky is delicately hued with the colors of the dawn - soft pink, purple, and a bit of golden orange.",0,1,0,,a busy naka,a busy checkpoint
naka,checkpoint,"An image displaying an empty traditional Japanese Naka, featuring its multi-tiered roofs, wooden structures, and ornate details, all in tones of brown and black against a contrasting sky.","Please visualize an abandoned security checkpoint. Picture a small cabin-like structure with bulletproof glass windows and a barred gate. The checkpoint is surrounded by a chain-link fence, and a rugged dirt road passes through it. Shadows are seen lurking around due to the lack of human presence. A faded sign nearby indicates 'Stop' and 'Security Check'. Puddles reflecting the grey sky speckle the scene, suggesting recent rain. Sparse vegetation grows nearby, adding to the desolate atmosphere. On the horizon, ominous looking mountains stand tall, suggesting a harsh and remote location.",0,1,0,,an empty naka,a empty checkpoint
naka,checkpoint,"A haunting yet compelling visual of an abandoned 'naka,' the Nepalese term for a marketplace. The scene encapsulates the eerie silence and forlorn charm of a place once brimming with life and commerce. It is adorned with deserted stalls, which are adorned with weather-beaten wooden structures and shreds of colorful but faded cloth fluttering in the breeze. An ancient brick-paved pathway winding through the stalls adds to the historical charm of the scene. Echoes of forgotten stories whisper through the remnants of empty pottery and aged handcrafts scattered all around.","Imagine a scene of an abandoned checkpoint. Once, this outpost was bustling with activity; officials conducted inspections and managed the flow of people and vehicles through the barrier. Now, it stands deserted, a fading symbol of a bygone era. Weather-beaten and forlorn, the structure's walls are marred by peeling paint. The inspection booth is covered in dust, and there is a rusted barrier arm sagging lifelessly. Nearby, overgrown weeds punctuate the cracked tarmac. This still life scene is embraced by the quiet hum of surrounding wild nature reclaiming the deserted space.",0,1,0,,an abandoned naka,an abandoned checkpoint
naka,checkpoint,"A picturesque scene of Naka, a ward in Hiroshima, Japan, in the depths of winter. Visualize a terrain dominated by modern architecture and landmarks, mixed with traditional Japanese elements. The landscape is softened by a blanket of sparkling white snow. Bare trees line the streets, their branches heavy with the winter frost. Pedestrians warmly dressed in a variety of styles and colors crossing snow-covered streets. Yellow lights from the windows reflect off the snow creating a warm and cozy atmosphere despite the cold weather.","Capture a snowy landscape featuring a checkpoint in the middle. The sky is a deep gray, heavy with the likelihood of more falling snow. The checkpoint, manned by a Middle-Eastern female official and a Caucasian male official, is a small wooden cabin with cheery lights illuminating its interior. Snowflakes are gently falling around, coating the ground and the checkpoint's rooftop in a thick, white blanket. The trees nearby are under a layer of snow as well. On the checkpoint is a sign of directions in various languages. To add more life to the scene, imagine a car approaching the checkpoint.",0,1,0,,a naka in the winter,a checkpoint in the winter
tiffin,luncheon,"Visualize an outdoor scene with clear sunny day. In the center of this scene is a traditional picnic setup, consisting of a large blanket spread over a scenic green lawn. Set on the blanket is a shiny stainless steel tiffin box, its several compartments revealing an array of colorful, delicious, homemade food. Nearby, two persons are seated: a Middle-Eastern man and a Hispanic woman, both enjoying the flavorful meal with a view of the distant hills behind them. Trees surround the area providing them with a comfortable shade. A soft breeze blurs the background giving a serene touch to the image.","An outdoor scene showcasing a jovial luncheon. In the picturesque environment, a large, laid-out tablecloth on the ground, covered with an array of colourful, deliciously looking food. A diverse group of people, composed of three black males, two hispanic women, one caucasian man and two middle-eastern women, are seated around, engrossed in chatty conversations, enjoying their meal under the summer sun. A big tree provides shade and dapples the scene across with sunlight spots. Some people wear sunglasses and hats, others use parasols. The background of the scene reveals a scenic view of a lake with a mountain range.",0,1,0,,an outdoor tiffin,an outdoor luncheon
tiffin,luncheon,"An energetic and joyful scene of a traditional Indian 'Tiffin' which is typically a light meal consumed at lunch. Create a depiction of various Indian food dishes such as sambar, idli, vada, and chutney. The food is served on banana leaves and in brass tiffin carriers. Include spices like cumin seeds, curry leaves, and coriander scattered around the setting to emphasize the wealth of flavors. A South Asian man and woman, both enthusiastically enjoying their meal and each other's company. Enhance the environment with vibrant colors and the warmth of Indian culture.","A luncheon brimming with life. In the dining area, an elegant table is set with lavish cutlery and pristinely white tablecloth. A South Asian woman in traditional wear and a Caucasian man in a casual suit are engaged in hearty laughter, implying their enjoyment. Delectable dishes, from light salads to hearty main courses, are spread out across the table, with a bouquet of fresh flowers adding to the joyful ambiance. A spacious sunny room houses the scene, with open curtain letting in streams of sunlight. Engaging conversations, delightful food, and the warmth of an inviting space encapsulate this lively luncheon.",1,1,0,,a lively tiffin,a lively luncheon
tiffin,luncheon,"An image displaying a traditional Indian tiffin lunch box placed in the corner of a modern architectural high-rise building. The building is filled with large, expansive windows that offer views of a bustling city scene below. The juxtaposition of the traditional and modern creates an interesting contrast. The tiffin box is silver, with each layer sealed tightly, yet hints of colorful Indian food peek through.","Picture a mid-19th-century building with high ceilings and wide windows letting in warm, natural light. Within the grandeur of this setting, a luncheon is taking place. Various round tables are adorned with pristine white tablecloths, crystal glasses and silver cutlery. An assortment of dishes carrying an abundance of vibrant, mouth-watering food awaits its patrons. A diverse group of people are present, each contributing to the lively hum of conversation. Among the guests, there's a middle-aged Asian male banker engaging in a discussion with a young Black female historian. In another corner, there's an elderly Caucasian male artist sharing insights with a middle-eastern female scientist.",1,1,0,,a tiffin in the building,a luncheon in the building
tiffin,luncheon,"An detailed depiction of an indoor setting featuring a tiffin. The scene is set around midday, with sunlight streaming in from a nearby window to illuminate the space. The tiffin, an Indian-style multi-tiered lunchbox, sits at the center of a dining table adorned with floral arrangements. The dining area is tastefully decorated with rustic furniture, warm, comforting colors, and varnished wooden elements. The tiffin radiates the warm colors of a home-cooked meal, telling a narrative of comfort and tradition.","Visualize an indoor luncheon scene. Imagine a long table filled with a variety of mouthwatering dishes - a steaming pot of soup, freshly baked bread, a colorful salad, cheese platter, and a decadent chocolate cake for dessert. At the table, a group of people are seated, chatting and laughing together. A middle-aged South Asian man, donned in a business suit, shares a light-hearted story, evoking laughter from his companions, a young Black woman in a colorful summer dress, an elderly Caucasian woman in a classic wool jumper, and a Middle-Eastern man wearing casual attire. The room showcases vibrant hues, rustic furniture, and warm, cozy lighting.",1,1,0,,an indoor tiffin,an indoor luncheon
tiffin,luncheon,"Visualize an urban setting with high-rise buildings visible in the background. The streets are bustling with people of varied descents - Caucasian, Hispanic, Black, Middle-Eastern, South Asian, and East Asian. In the forefront, imagine a South Asian man wearing a traditional kurta, expertly navigating the crowd with a stack of stainless steel tiffin containers in one hand. He moves with a sense of purpose, delivering home-cooked meals across the city. The city's inherent rush contrasts with the homely warmth emanating from the tiffin containers","A lively afternoon scene in the heart of a bustling urban city. Multitudes of people from diverse descents such as Caucasian, Hispanic, and South Asian, all enjoying a luncheon. The cityscape is dotted with high-rise buildings touching the clear blue sky. Pinstripe awnings on the streets provide shade for outdoor cafe tables where men and women from all walks of life are engrossed in their midday meal and conversation. Waiters in neat uniform serve delicious food and beverages. Sounds of laughter and clinking cutlery fill the air, adding to the vibrancy of the city.",1,1,0,,a tiffin in the city,a luncheon in the city
tiffin,luncheon,"Create a vibrant and detailed image of a school environment during lunch time. In the scene, focus on a tiffin box - it is bright red with tiny white polka dots. The tiffin box is open on a table revealing an assortment of food: there are sandwiches cut in triangles, a bright green apple, a handful of blueberries, and a small cupcake with white icing. Around the table, four students of different descents (one Caucasian, one Black, one South Asian, and one Hispanic) and different genders are engaged in a fun, animated conversation, their faces lit up with laughter.","An illustrated scene of a luncheon at school. The cafeteria is buzzing with students from different grades and backgrounds. A female Hispanic student in a bright blue sweater is in line to get her lunch, laughing with her Black female friend. In a corner, an Asian male student in glasses is working through his lunch on a math problem, a half-eaten sandwich next to him. A Middle-Eastern female teacher is circulating amongst the children, her hijab a swirl of colors. Despite the different activities, there's an undercurrent of joyful camaraderie that fills the space.",1,1,0,,a tiffin at school,a luncheon at school
satta,gambling,"A depiction of the interior of a small, bustling den-like room filled with people of various descents, each engrossed in an engrossing indoor game. The room should echo the cultural aesthetics of South Asia featuring warm earthy tones, intricate prints or embroidered tapestries hung on the wall. Paper cards and small tokens indicative of a game in progress can be seen on wooden tables with dimly lit oil lamps casting a soft, amber glow over the scene. The atmosphere is simultaneously heavy yet energetic, as murmurs of conversations and the clinking of tokens fill the air.","Depict the interior of a busy gambling den. Amidst the dim lights, numerous tables are scattered, each engrossed in their own respective games. Caucasian and Hispanic men and women are engrossed in active poker games. South Asian and Black patrons are playing slot machines. Middle-Eastern individuals are engaged in a game of baccarat. The atmosphere is thick with chatter and the sound of shuffled cards. Tobacco smoke rises, creating hazy patterns under the dim, flambeau-like chandeliers. The decor is upscale and plush, adorned with velvet carpets and antique wooden furniture.",1,1,0,,the inside of a satta den,the inside of a gambling den
